label,text
divorce,How Acting Like You're Divorced Could Save Your Marriage
divorce,When Should A Stepparent Step In?
divorce,"LeAnn Rimes, Eddie Cibrian And Other Celebrities Who Married Their Affair Partners"
divorce,Divorce Diaries: I'm Excited To Be Interested In My Life
divorce,Is 'I Do' Supposed To Be Forever?
divorce,"LeAnn Rimes, Brandi Glanville: 5 More Stars Who Dissed Their Spouse's Ex"
divorce,Is the US Divorce Rate Going Up Rather Than Going Down?
divorce,The Sexy Splurge That Got Me Through My Split
divorce,"Jilted Husband Sues Bride For Allegedly Taking $72,000 In Wedding Gifts"
divorce,Top 10 Songs To Get Through Divorce
divorce,I Left My Children In Kansas City
divorce,Seven Divorce Stories That Might Shock You
divorce,10 Signs You're Having An Emotional Affair
divorce,5 Ways to Overcome Your Fear of Commitment
divorce,Dear Prudence: My Husband Has Asked For An Open Marriage After Discovering My Affair. - Slate Magazine
divorce,Why I Left You: Tweeters Reveal The Reasoning Behind Their Splits
divorce,Your Yearbook Photo May Predict Your Likelihood Of Divorce
divorce,Life After Divorce: I Pledge the Following
divorce,It Happened To Me: I Had Very Public Affair And Got Fired For It
divorce,"Stop Painting Your Ex as a Horrible, Negligent Addict and Resolve Your Divorce Guilt"
divorce,Dennis Rodman -- FINALLY DIVORCED
divorce,My Husband The Impostor
divorce,Ending Your Affair With Integrity
divorce,The Three Key Players Every Woman Needs on Her Divorce Team
divorce,Co-Parenting Across The Globe Led This Divorced Military Couple To Remarry (VIDEO)
divorce,Dr. Oz: HPV Is Not A Tell-Tale Sign Your Spouse Is Cheating (VIDEO)
divorce,"Having An Affair: Finding An Affair Partner Takes Only 36 Hours, According To AshleyMadison.com"
divorce,How To Prevent Litigation In Divorce Disputes
divorce,5 Reasons Sex on a First Date Is a Bad Idea
divorce,How I Stopped My Ex's Cyber-Bullying
divorce,"Divorce, Illness and Compassion"
divorce,Disney Princesses Who Would Probably Be Divorced By Now
divorce,This Is Why You're Fated To Be Single Forever (VIDEO)
divorce,Sleeping With the Enemy: Saving Your Family After an Affair
divorce,Back-To-School Tips: How Divorced Parents Can Make School Season Less Stressful
divorce,Kristen Wiig Opens Up About Love After Divorce
divorce,Overcoming Communication Barriers In Marriage & Divorce
divorce,Father's Day 2013: Our Favorite Celebrity Stepdads
divorce,5 Benefits Of Having A Friend With Benefits
divorce,Social Media Study Finds Link Between Media Use And Relationship Satisfaction
divorce,Your Five Best Moves Before You Decide to Divorce
divorce,Kelsey Grammer Divorce: 'Boss' Star Tells Oprah He 'Owed' Camille Fame (VIDEO)
divorce,Bethenny Frankel Divorce: Reality Star Talks 'Drawbacks And Stresses' Of Single Parenthood
divorce,Thirteen Reasons Why Your Marriage May Fail In 2013
divorce,Arnold Schwarzenegger Still Loves Maria Shriver? 5 More Celebs Who Still Love Their Exes
divorce,Cheating Signs: 6 Signs You Might Cheat On Your Spouse
divorce,"Wanted: Strong Male To Unite, Protect"
divorce,I Just Wish He Would Have An Affair!
divorce,Is It Easier To Deal With Divorce When You Made The Choice To Leave?
divorce,'Being A Stepmother Has Been More Gratifying Than I Would Have Ever Expected'
divorce,Being at Home
divorce,7 Reasons I Don't Believe Rielle Hunter's Apology
divorce,Kim Kardashian's Baby: 6 Other Stars Who Conceived While Still Married To Their Exes
divorce,Why I Finally Stopped Lying To My Teenage Son About Dating
divorce,Divorce And Remarriage: How I Stopped Hating My Ex's New Wife
divorce,Funny Divorce Bumper Sticker Tells It Like It Is (PHOTO)
divorce,Celebrity Divorce: Star Couples Who Vowed Never To Split
divorce,Top 3 Mistakes Men Make After Divorce
divorce,25 Signs Your Relationship Won't Survive Much Longer
divorce,Getting Back Into The Dating World After Divorce
divorce,Missed Connections
divorce,12 Terrible Pieces Of Marriage Advice
divorce,ALPHA MALE: Shopping Help For Divorced Guys
divorce,What Everyone Should Know About The Female Orgasm And Hooking Up (INFOGRAPHIC)
divorce,Graduation? Communion? Bar Mitzvah? Best Tips for Event Planning for Divorced Parents
divorce,La Toya Jackson Details Ex-Husband Jack Gordon's Abuse On HuffPost Live (VIDEO)
divorce,Five Things Women Can Do Today to Move Past Divorce
divorce,The Five Key Points Divorcing Women Need To Know About Financial Affidavits
divorce,Kathy Griffin Divorce: Comedian Talks Tattooed Wedding Ring
divorce,The Five Lessons Divorced People Learn About Marriage
divorce,"Kate Winslet, Sam Mendes Divorce: Director Transfers Multi-Million Dollar Chelsea Penthouse To Actress"
divorce,Signs It's Time to Engage a Parenting Coordinator
divorce,'Pregnant Man' Thomas Beatie Divorce: Claims Wife Punched Him In The Crotch
divorce,Danica McKellar Divorce: 'Wonder Years' Actress Not Quite Ready To Date
divorce,"Fire Away: A Husband, A House, A Mortgage... the Sequel"
divorce,Should You Divorce Over Cosmetic Surgery?
divorce,Two-Thirds Of Cheaters Would Have An Affair With A Boss If This Was At Stake
divorce,"Kim Kardashian, Kanye West And 6 Other Celebs Who Romanced A Pal Post-Split"
divorce,Blended Family Friday: Meet Wendy And George's Family (PHOTOS)
divorce,Christina Hendricks Encouraged Her Parents' Divorce
divorce,Jesse James Engaged To Alexis DeJoria? It Won't Be His First Trip Down The Aisle
divorce,Celebrity Couples Who Amicably Divorced (VIDEO)
divorce,Dennis Quaid Divorce: Kimberly Buffington-Quaid Reconciles With Dennis Quaid
divorce,The Benefits Of Dating Single Dads
divorce,Blended Families Make for a Spicy and Happy Meal
divorce,Why You Blame Yourself For Bad Relationships -- And How To Stop
divorce,For Better or Worse? Secret Divorce Regrets
divorce,5 Things To Know About Your Jewelry When Getting A Divorce
divorce,'After Happily Ever After': Filmmaker Searches For Marriage Secrets (VIDEO)
divorce,Cheating: Experts Weigh In On Female Infidelity (VIDEO)
divorce,Why Not the Fairest?
divorce,Kids Need Dads!
divorce,"Sesame Workshop Launches 'Little Children, Big Challenges' Divorce Initiative (VIDEO)"
divorce,How to Be the Best Stepmom Ever
divorce,What's Love Got To Do With It? What To Do When You're A Stepmother Who Doesn't Love Her Stepchildren
divorce,Financial Infidelity: What To Do When Someone Financially Cheats?
divorce,How Do I Tell My Kids My Marriage Is Over? [VIDEO]
divorce,4 Things That Will Pronounce a Relationship D.E.A.D.
divorce,How To Apologize For An Affair
divorce,Divorce and Devotion: How Does Religion Factor In Splits?
divorce,Life After Divorce: 15 Quotes To Help You Let Go After Divorce
divorce,"Rupert Sanders, Liberty Ross Divorce: Did Infidelity Cause Their Split?"
divorce,"Local Mom Gives A ""Hand Up"" To Single Mothers"
divorce,Divorced Couples That Couldn't Stand Each Other When They Were Married But Now Share Holidays
divorce,He Never Kisses Me Anymore
divorce,How Social Media Can Affect Your Divorce
divorce,The Post-Divorce Dating Game: Tips to Make Your First Couple of Dates Fun Rather than Dysfunctional
divorce,LearnVest - Why Breaking Up Was Good For My Money
divorce,Why Pets Matter In A Divorce
divorce,"Andie MacDowell, 'Groundhog Day' Actress, Can Tell When A Woman Is Going Through Divorce"
divorce,Divorce In Your Twenties: What It's Like To Split At 28
divorce,Suspicious? Know If Your Fears Are Real
divorce,Divorced Girls Behaving Badly
divorce,When Does Flirting Become Cheating? 9 Red Flags
divorce,Traveling As A Single Parent
divorce,Tips For Divorced Parents To Have A Stress-Free Summer Vacation
divorce,Where's My F-ing Casserole?
divorce,Forbes' Richest People: 7 Divorced Billionaires (PHOTOS)
divorce,To Date or Not to Date? That Is the Question
divorce,The Sleeper Effect
divorce,The Santa Split and Making It Through the Holidays
divorce,How To Connect With Your School-Aged Children When You're Separated Or Divorced
divorce,SEXpectations
entertainment,Worst Movie Moms: A Look At The Craziest Matriarchs For Mother's Day (MASHUP)
entertainment,Karla Souza Teases Who Will Die This Season On 'How To Get Away With Murder'
entertainment,J.J. Abrams Reveals Lupita Nyong'o's 'Star Wars' Character's Backstory
entertainment,'One Direction: This Is Us' Box Office Finds 3-D Concert Film Serving Up Victory Against 'The Butler'
entertainment,'Transparent' Creator Dedicates Best Comedy Series Win To Leelah Alcorn
entertainment,People Want Oprah To Run For President After Her Powerful Golden Globes Speech
entertainment,"What Happened To The Roanoke Colonists, According To 'American Horror Story'"
entertainment,Sarah Palin Tries (And Fails) To Mock Tina Fey In '30 Rock' Spoof
entertainment,How Jewish Is It? Art Spiegelman at the Jewish Museum and Lost Childhood Opera in Bethesda
entertainment,Chris Hemsworth's Wife Elsa Pataky Posts Sweet Photo To Celebrate His Birthday
entertainment,Now Boba Fett Is Getting His Own 'Star Wars' Movie
entertainment,"Constance Wu, Actual Asian Person, Will Star In 'Crazy Rich Asians'"
entertainment,"Pink Giggles Her Way Through Meet And Greet With Mega-Crush, Johnny Depp"
entertainment,John Stamos Gets Engaged To Caitlin McHugh At The 'Happiest Place On Earth'
entertainment,The 7-Year-Old Actress In 'The Florida Project' Gives The Year's Best Screen Performance
entertainment,YOGA Master: Diamond Dallas Page's Reluctant Destiny
entertainment,Netflix Takes A Stand Against Data Caps So You Can Stream All You Want
entertainment,Wonder Woman Isn't Just Fast And Strong. She's Also A Physics Genius.
entertainment,Dina And Caroline Manzo Get Blunt About Family Feud
entertainment,Louis C.K. Has Been Baiting Us
entertainment,President Obama Weighs In On Oscars Controversy
entertainment,Man Claims Ex Cares More About ‘Nonexistent’ Singing Career Than Their Daughter
entertainment,New Artist Reviews: Tetra
entertainment,All The Movies You Can Go See On Christmas Day
entertainment,What Apple's U2 Stunt Really Says About the Future of Music
entertainment,15 Movie Mistakes You Didn't Notice In Your Favorite Action Films
entertainment,Kristen Stewart: 'I Need To Breathe'
entertainment,Reese Witherspoon Had The 'SNL' Cast Apologize To Their Moms
entertainment,"William Christopher, Father Mulcahy On 'M.A.S.H.,' Dies At 84"
entertainment,"22 Toys Every 'Star Wars,' 'Transformers' & Marvel Fan Should Know About"
entertainment,Jeremy Lin Respectfully Responds To Racial Slur On Twitter
entertainment,Kim Kardashian Poses In A Nude Bodysuit On A Pile Of Dirt In Kanye West-Styled Shoot
entertainment,Emma Watson Pole Dances In 'Bling Ring'  Scene (VIDEO)
entertainment,Cast Of 'Will & Grace' Reportedly In Talks For Ten-Episode Revival
entertainment,VFX Town Hall Meeting Urges Trade Association and Union
entertainment,Sarah Jessica Parker Says Ellen Can Play Samantha In 'Sex And The City 3'
entertainment,"Mel B Throws Water At Simon Cowell, Exits After His Marriage Jab On 'AGT'"
entertainment,Donald Trump Is Lovin' New McDonald's Jingle In 'Tonight Show' Bit
entertainment,"'Reclaiming My Wine' Is The Motto For 2018, Courtesy Of Amy Poehler"
entertainment,Jenna Dewan Tatum Hinted At Marital Trouble With Channing Tatum Months Ago
entertainment,"The Ultimate Casper, Wyoming, Road Trip Playlist"
entertainment,Andy Samberg Will Host The Emmys
entertainment,Jared Leto And Jimmy Fallon Struggle Mightily With 'Name That Song'
entertainment,'Westworld' Season 2 Teaser Suggests Violent Delights Have Violent Ends
entertainment,Major Networks Are Becoming More Inclusive Of Asian-Americans: Report
entertainment,"'Nashville' Is Coming To CMT, But Connie Britton Might Be Already Gone"
entertainment,Here's A 'Scream Queens' Theory To Consider
entertainment,Kacey Musgraves Dreams Of A Day When ‘We Have A Gay Country Music Icon’
entertainment,Maisie Williams Launches YouTube Channel With Spot-On 'Game Of Thrones' Impression
entertainment,So Aaron Carter Just Asked Chloë Grace Moretz On A Date Over Twitter
entertainment,Filmmaker Says 'Stranger Things' Creators Stole His Ideas In New Lawsuit
entertainment,North West Is The Cutest Little Minnie Mouse
entertainment,Director Of Tarantino Documentary Wants Out Of Weinstein Co. Partnership
entertainment,Scott Disick Is Reportedly Dating A Kendall Jenner Doppelgänger
entertainment,Doo Doo The Clown From 'Billy Madison' Becomes City Hero After Rescuing Women
entertainment,"'The Great Gilly Hopkins,' One Of Your Childhood Faves, Is Finally A Movie"
entertainment,The One Scene That Sets 'Apes' Apart From Other Blockbusters
entertainment,These Celebrities Stole The Show At The AMAs With Their Awesome Dance Moves
entertainment,"5 Things You Didn't Know About 'Fringe,' According To Dr. Bishop"
entertainment,Harvey Weinstein’s City Of Stars
entertainment,Bill Paxton Learns of His Revolutionary Past On 'Who Do You Think You Are?'
entertainment,Julia Louis-Dreyfus Breaks Record For Emmy Wins
entertainment,A New Madonna Song Leaked Online
entertainment,Sean And Catherine Lowe Are Glad The New 'Bachelor' Isn't A Young Guy Looking For Instagram Love
entertainment,Can Jennifer Lawrence Be Taken Seriously as an Action Hero?
entertainment,Netflix Buys Comics Company Behind 'Kingsman' And 'Kick-Ass'
entertainment,Here’s What Is Coming To Amazon Prime In May 2018
entertainment,Revisit The Musicians Of The 'Buena Vista Social Club'
entertainment,"Tyga Gave Kylie Jenner Another Luxury Car For Her Birthday, Obviously"
entertainment,Paris Police Chief Says There Is 'No Doubt' Kim Kardashian's Robbery Was Real
entertainment,Nicole Kidman Said The Sweetest Thing To Keith Urban In Her Golden Globes Speech
entertainment,'Star Wars 1313': Take A Sneak Peek At The New Game (PHOTO)
entertainment,Lifetime's 'Harry and Meghan: A Royal Romance' Was… Good?
entertainment,'Narcos' Location Scout Found Dead In Mexico
entertainment,Kat Graham Prepares To Say Goodbye To 'The Vampire Diaries'
entertainment,Raise Your Hand If You Think Chris Evans And Jenny Slate Are Back Together
entertainment,John Legend Throws Chrissy Teigen The Best Birthday Party Ever
entertainment,2012 in Film: The Runner-Ups
entertainment,"An Editor's Transcendent Experience At The Apollo, With The Boss"
entertainment,Jessica Simpson Is Officially Married To Eric Johnson
entertainment,Andrew Garfield Is A Damn Hero In The 'Hacksaw Ridge' Trailer
entertainment,Amy Adams And Jimmy Fallon Sing Rihanna And 'Grease' Songs Like Batman
entertainment,Kylie Jenner Is Celebrating Her 18th Birthday At A Beach Club In Canada
entertainment,Matt Damon Thinks Jason Bourne Would Definitely 'Kick The S**t Out Of Batman'
entertainment,"Tiffany Haddish Has Dating Tips For Guys, And None Involve Turpentine"
entertainment,The 'Kindergarten Cop 2' Trailer Looks Exactly Like 'Kindergarten Cop'
entertainment,Amy Schumer Drunk-Ate Jake Gyllenhaal's Cake
entertainment,Tom Hanks Reveals The Origin Of His Famous 'Forrest Gump' Accent
entertainment,Selenis Leyva Says 'Orange Is The New Black' Season 4 Is About 'The Rise Of The Latinas'
entertainment,James McAvoy Got Buff And People On Twitter Really Like It
entertainment,They're Coming!
entertainment,Clive Owen Talks 'The Knick' Season Finale
entertainment,Rapper Pitbull Dubs Donald Trump's Presidential Campaign 'A Joke'
entertainment,How You May Sabotage Yourself Before You Start to Pursue Your Goals
entertainment,'Guardians Of The Galaxy Vol. 2' Soars Past 'Fate Of The Furious' At The Box Office
entertainment,Elizabeth Olsen Isn't Pleased With Tom Hiddleston's Honky Tonkin' In This 'I Saw The Light' Clip
entertainment,Bill O'Reilly Is Asking Fans To Pay $50 A Year For 'Premium' Access To His New Show
entertainment,Lady Gaga's 'G.U.Y.' Video Resurrects Jesus And Michael Jackson
entertainment,Evan Rachel Wood Is Reportedly Dating Katherine Moennig
entertainment,Bran Is Officially Returning For 'Game Of Thrones' Season 6
entertainment,Will Ferrell And Maya Rudolph Hilariously Impersonate 'Real Housewives'
entertainment,In Praise Of The 'Mother!' Marketing Campaign
entertainment,"Good News, Wizards! J.K. Rowling Reveals Hogwarts Is Free"
entertainment,Is Music Dead? (Thoughts on the Music Industry After SXSW 2015)
entertainment,'RHONY' Star Luann de Lesseps Apologizes After Battery Arrest
entertainment,8 Quotes To Make You Glad You Aren't Experiencing The Same Groundhog Day As Bill Murray
entertainment,Channing Tatum's Marilyn Monroe Dress And Thong Details From 'Magic Mike'
entertainment,Dax Shepard's Sweet Throwback Photo Shows Us Love Is In The Eye Of The Beholder
entertainment,Vanessa Bayer To Leave 'Saturday Night Live' After 7 Seasons
entertainment,Shonda Rhimes Shuts Down Jesse Williams Haters With One Tweet
entertainment,"Interview: Vera Farmiga on At Middleton, Bates Motel and The Conjuring"
entertainment,How Are Jennifer Lawrence's Oscar Chances?
entertainment,How Kate Winslet And Leo DiCaprio Used 'Titanic' To Help A Cancer Patient
entertainment,Miley Cyrus Gets Tattoo Of Dead Dog
entertainment,The Lonely Island Is Getting A Movie
entertainment,"J. Cole And TLC Will Collaborate For 'Born Sinner,' Cole's Next Album"
entertainment,"Natalie Cole, Legendary Jazz Singer Who Carried Father’s Legacy, Has Died"
entertainment,John Krasinski's 'A Quiet Place' Is Basically This Episode Of 'The Office'
entertainment,'We Can't Stop Smiling': James Corden And Wife Julia Carey Welcome Baby Girl
entertainment,'AHS: Freak Show' Recap: Murder At A Tupperware Party (SPOILERS)
entertainment,Rob Reiner Thinks Clint Eastwood's RNC Speech Was 'Embarrassing'
entertainment,Rick Astley Rolls His Way To Number 1 In UK With New Album
entertainment,"Now That The Old Taylor Swift Is Dead, The New One Is Slapping Her Face On UPS Trucks"
entertainment,Ryan Adams Calls Out Donald Trump With Gripping Cover Of 'Karma Police'
entertainment,Timothée Chalamet Is The Heartthrob We Need
entertainment,Cameron Crowe Leads A Musical Tour Through His Filmography
entertainment,"Another Excerpt: I ""Discover"" CBGB and Open for The Ramones, May, 1975"
entertainment,You Can Now Preview Trent Reznor's Eerie 'Gone Girl' Soundtrack
entertainment,Kristen Bell Spilled On One Of The Dumbest Fights She's Had With Dax Shepard
entertainment,That Little Kid From 'Wife Swap' Still Thinks Bacon Is Good For Him
entertainment,Celebrities Stick It To Donald Trump With Dramatic Rendition Of 'I Will Survive'
entertainment,'Booker's Place': Exploring the South's Troubled Legacy of Race
entertainment,Is The Amazing Spider-Man the Next Batman Begins or Merely the Next Superman Returns?
entertainment,MTV Resurrects 'TRL' As Voter Registration Special For One Day Only
entertainment,Steven Avery's Other Former Fiancee Maintains He's Innocent On 'Dr. Phil'
entertainment,The Killer Questionnaire? What Fans of WhoDunnit? Are Dying to Know
entertainment,Amy Schumer Continues To Kill It At Throwback Photos
entertainment,'The Fifth Estate' Bombs On Friday Night; 'Gravity' Holds No. 1
entertainment,Charlie Sheen Sues National Enquirer Over Corey Haim Rape Allegation
entertainment,5 Of The 'Biggest Moments In TV' Are Coming To 'Game Of Thrones'
entertainment,Rosie O'Donnell Takes on Brian Williams at the Athena Film Festival
entertainment,Kendall Jenner Has Wise Words For Supermodel Who Called Her And Gigi Hadid 'B***hes Of The Moment'
entertainment,Redfoo Keeps The Party Rockin' With Debut Solo Album
entertainment,Rob Kardashian Is Way Better At Valentine's Day Than You
entertainment,Jimmy Fallon And Demi Lovato Are Ultimate Best Friends
entertainment,Miley Cyrus' Fourth Of July Got Weird
entertainment,Gaby Hoffmann Is Pregnant With First Child
entertainment,This Video Of Kourtney Kardashian Eating A Kit Kat Bar Is Celeb Culture Run Amok
entertainment,"Music Legend Hal David Passes, But His Lyrics Still Resonate"
entertainment,Who Is Qualified To Sing At Mariah Carey's Wedding? 'F**king Nobody'
entertainment,"Scott Weiland Died From Toxic Mix Of Drugs, According To Medical Examiner"
entertainment,Five Questions with The Avett Brothers at MerleFest
entertainment,'Ouija' Scores With $8.3 Million At The Box Office Friday
entertainment,7 Celebrity Couples Who Broke Up Before Getting Married
entertainment,The Rock Shares His Ultimate Workout -- And We’re Exhausted Just Watching It
entertainment,Evan Peters Reveals His 'X-Men' Character Quicksilver's Future
entertainment,'Deadliest Catch' Star Jake Harris Recovering After Being Severely Beaten
entertainment,5 Seconds Of Summer's Michael Clifford Falls Off Stage At BBC Radio 1 Teen Awards
entertainment,Isn't It Ironic Justin Timberlake & Jimmy Fallon Crack Up While Singing 'Ironic'?
entertainment,Chrissy Teigen Roasts John Legend Over That 'La La Land' Oscar Loss
entertainment,Channing Tatum Is Unrecognizable In The New ‘Hateful Eight’ Trailer
entertainment,"Evangeline Lilly Dreamt About Being An Elf Before Joining ""The Hobbit 2"" (WATCH)"
entertainment,Stephen King Reveals Why Donald Trump Blocked Him On Twitter
entertainment,Exclusive 'Room' Clip Explores A Brave New World
entertainment,Lauren Cohan Of ‘The Walking Dead’ Confirms Maggie Will Be Back For Season 9
entertainment,"First Teaser For 'Trainspotting' Sequel Promises More Reckless Thrills, 20 Years Later"
entertainment,Celebs Share Touching Photos With Their Mamas On Mother's Day
entertainment,New ‘Beauty And The Beast’ Character Posters Will Make You Smile Like a Kid
entertainment,"Someone Tried To Come For Kim Kardashian, But John Legend Shut It Down"
entertainment,Ellen Tears Up When Ashton Kutcher Donates $4 Million To Her Wildlife Fund
entertainment,Philip Seymour Hoffman (1968-2014): So Great in the Now Ironically Titled A Late Quartet
entertainment,Hilary Mantel: The Star of 'Wolf Hall'
entertainment,Cate Blanchett Feted at the New York Film Festival
entertainment,The Kid Stays in the Picture
entertainment,Kelly Ripa Returns To 'Live' And Speaks From The Heart After Week-Long Absence
entertainment,"'Iron Man 3,' 'Despicable Me 2,' 'Fast & Furious 6' Top Highest-Grossing Films List Of 2013"
entertainment,"'Downton Abbey' Recap, Season 4, Episode 3: Gillingham Is the Suitor Lady Mary Never Dreamed Of"
entertainment,The La La Land Mishap is Not the Most Important Academy Flub
entertainment,"Meet Mica Levi, The Musical Mastermind Breaking Through A Male-Dominated Oscar Field"
entertainment,Justin Bieber Celebrates His 21st Birthday Shirtless
entertainment,Redditors Revive Old Image Of Conan O'Brien As A Superhero
entertainment,Screenplay for a 60th Wedding Anniversary
entertainment,Kevin Smith’s Daughter Was Nearly Abducted By Fake Uber Drivers
entertainment,"Singer David Cassidy, 1970s Teen Idol, Dies At 67"
entertainment,Interview: Director Kevin Macdonald on Black Sea
entertainment,Kylie Jenner Showers In A White T-Shirt In Steamy Short Film
entertainment,"The Strange Intimacy Of 'Serial,' Podcast Of The Year"
entertainment,'Mr. Robot' Creator Also Thinks It's Weird That Things In The Show Keep Coming True
entertainment,Morrissey's Tour Canceled As Singer Cites 'Medical Reasons'
entertainment,"Movie Reviews: Red Flag, Rubberneck"
entertainment,Inside AmericanaFest: Allison Moorer and 5 First-Time Faves
entertainment,The One 'Star Wars: The Force Awakens' Theory No One Is Talking About
entertainment,Ed Sheeran Casually Rocks Out With The Rolling Stones
entertainment,Neil DeGrasse Tyson Explains The Real Problem With That 'Titanic' Debate
entertainment,"Kimye, John Legend And Chrissy Teigen Double Date At Waffle House"
entertainment,Selena Gomez Wants Everyone To Know Who She Is Now
entertainment,Rob Lowe: 'Living Well Is The Best Revenge'
entertainment,'Avengers' Stars Laugh In The Face Of Twitter Trolls' 'Mean Tweets'
entertainment,Mom Whose Bullied Daughter Committed Suicide Is On A Crusade
entertainment,Lawrence O’Donnell’s Future At MSNBC Is Unclear
entertainment,Justin Bieber Unveils Trailer For New Documentary 'Believe'
entertainment,Frightened Rabbit Singer Scott Hutchison Dead At 36
entertainment,'Star Wars' Is Pretty Much Happening In Real Life Because Beyoncé Is Pregnant With Twins
entertainment,MasterChef Recap: The Yolk Is No Joke in 'Top 8 Compete'
entertainment,Melissa Gilbert: Why I Ditched My Breast Implants
entertainment,One Direction's Louis Tomlinson Welcomes Baby Boy With Briana Jungwirth
entertainment,A Wrenching New Ferguson Documentary Asks: How Can We Start A Revolution?
entertainment,Wiz Khalifa's Stoner Rap Version Of Adele's 'Hello' Is Here
entertainment,A Documentary About The Harvey Weinstein Scandal Is In The Works
entertainment,Oprah Winfrey Says 'I Wouldn't Have Been A Good Mom For Babies'
entertainment,Hugh Hefner Fans On Twitter Thank Him For The Articles
entertainment,Catherine Deneuve Kicks Off Rendez-vous With French Cinema
entertainment,YouTube Star Logan Paul Sparks Outrage With Disturbing 'Dead Body' Video
entertainment,'The Invisible Woman' Trailer Finds Ralph Fiennes Taking On Story Of Charles Dickens' Mistress
entertainment,A Glorious 'Felicity' Reunion Happened
entertainment,Lupita Nyong'o's Pearl Oscar Dress Has Been Fake This Whole Time
entertainment,'Mad Max' Mashed Up With 'Mario Kart' Is Perfect In Every Way
entertainment,The Best Spike Lee Movies
entertainment,Ne-Yo On 'Saturday Night Live': Singer Performs 'Let Me Love You' And 'She Is' (VIDEO)
entertainment,Jane Siberry's Holiday Hoes and Hosers Brings Magic to Iridium Jazz Club
entertainment,Singer Jake Owen Describes Las Vegas Shooting: 'We're All Still Trying To Process'
entertainment,"'Moonlight,' 'Jackie' And 'Manchester By The Sea' Just Got The Year's First Big Oscar Bump"
entertainment,The Super Bowl Blessed Us With The First 'Stranger Things' Season 2 Teaser
entertainment,'Dancing With The Stars' Pros Maksim Chmerkovskiy And Peta Murgatroyd Are Engaged
entertainment,"HBO's Girls, Kendall Jenner and Me: Despicable U.S."
entertainment,Laura Dern And NBA’s Baron Davis Look Pretty Sexy Smooching In Public
