label,text
technology,How Using Your Phone To Pay For The Subway Can Help Fight Climate Change
technology,Tim Cook Swipes At FBI During New iPhone Event
technology,WATCH: The 9 Most Viral Ads That Have Aired During The Super Bowl
technology,Surprising Number Of Americans Would Chop Off A Finger To Stay Online
technology,Mark Zuckerberg: Mobile Is Facebook's Biggest Challenge
technology,Cathedral Moves Sculpture Because Texters Keep Bumping Into It
technology,Android 'Stagefright' Bug Leaves Up To 950 Million Devices At Risk
technology,The Biggest Moments From 20 Years Of Google History
technology,"Uber, Reeling From Controversies, Loses Another Executive"
technology,Tim Cook's July Fourth Tweet Has A Not-So-Subtle Message
technology,More Iran Internet Disruptions Raise Concerns Over Censorship As Elections Loom
technology,Todd McLellan's 'Things Come Apart' Showcases Beautiful Photos Of Disassembled Technology (PHOTOS)
technology,Tajikistan Blocks Facebook
technology,Here's Beautiful Drone Footage Of Your Next Vacation Spot
technology,Steve Wozniak Just Blasted Uber For Poor Treatment Of Workers
technology,Cookie Monster Is Taking Over The Internet One Page At A Time
technology,"Why Mobile Apps Have Become The ""In"" Thing"
technology,"Google Image, The Daily Stormer And Anti-Semitism"
technology,6 Times Women In Tech Faced Total BS In 2015
technology,Spotify To Raise $100 Million At $3 Billion Valuation: WSJ
technology,Pinterest Is Not Messing Around On Diversity
technology,Google's Getting Cozy With Texas
technology,How Does Facebook Make Money?
technology,Cambridge Analytica Files For Chapter 7 Bankruptcy After Facebook Privacy Row
technology,Twitter Goes Down And Everyone Freaks Out On Facebook And Instagram
technology,The Battle for the Future of the Internet?
technology,Can Gamers Save the World?
technology,Europe Wants U.S. Companies Like Google To Play By New Privacy Rules
technology,6 Ways College Grads Can Protect Their Online Reputations
technology,How New Secure Credit Cards Are Hurting Netflix And Other Companies
technology,Twitter Reverses Stance On Archiving Politicians’ Deleted Tweets
technology,'Finding Nemo' Told With Emoji Is Pretty Freaking Adorable
technology,The Very Best Apple Black Friday Deals In The U.S.
technology,Twitter Warns Some Users Of State-Sponsored Hack
technology,Facebook Backtracks After Telling Reporter It Suggests Friends Based On Phone Location Data
technology,"Silicon Valley Companies Fight For Talent, Pay Extravagant Salaries"
technology,Bloomberg's Program To Build Better Cities Just Got Bigger
technology,Taking 'A Total Disruption' Open Source
technology,Private Company Wins U.S. Clearance To Fly To The Moon
technology,This Underwater Airplane Flies Through The Ocean Unlike Any Submarine Before It
technology,Tinder Now Lets You 'Swipe Up' On People You REALLY Like
technology,"Your Next iPhone Might Not Have To Be Plugged In To Anything, Ever"
technology,"Google, Facebook See No Significant Impact On Business From NSA Revelations"
technology,Samsung Recalls Galaxy Note 7 Phones Over Exploding Battery
technology,Apple's Second Apology To Samsung Is Much Less Snarky
technology,FlyingBuddy2: Pilot This Mind-Controlled 'Copter With Nothing But Your Thoughts
technology,How to Cheat the Iron Triangle With Tony Schwartz
technology,The Internet Of Things Needs A Code Of Ethics
technology,Your City Could Be The First To Embrace The Future Of Transportation
technology,"Woman Pays For Two iPhones, Reportedly Tricked Into Buying Two $600 Apples Instead"
technology,Watch The Top 9 YouTube Videos Of The Week
technology,Global Cyber Attack Eases Due To One Researcher's Quick Thinking
technology,"Microsoft's Vague New Privacy Terms, Explained"
technology,Apple TV With Gesture Control? iWatch Next Year? This Week In Apple Rumors
technology,'Flappy Bird' Creator Taking App Down: 'I Cannot Take This'
technology,Scientists Are Working On Prosthetics Controlled By Your Mind
technology,Formlabs 3D Printer Is A Desktop-Sized Industrial-Grade Device You Can (Almost) Afford
technology,The 'iWatch' Slap Bracelet And 'iPad Mini Retina' Photos: This Week In Apple Rumors
technology,Twitter Wins Dismissal Of Lawsuit Alleging Islamic State Support: Federal Judge
technology,Is NYC Beating DC in Tech?
technology,Use These Special Pope Emojis And Be #Blessed
technology,Watch The Top 9 YouTube Videos Of The Week
technology,Rumor Has It That 2014 Will Finally Be The Year Of The 'iWatch'
technology,Meg Whitman's Pay Package Tops $15 Million After HP Posts Net Loss In 2012
technology,Protect Your Inbox From Phishing And Other Email Attacks
technology,Check Out Google's New Logo
technology,The Collective (Un)Consciousness; Remember Your Dreams
technology,Now You Can Print Your Instagram Photos In Just 10 Seconds
technology,Facebook Has Halloween Snapchat-Like Filters For Live Video
technology,John McAfee Offers To Hack Terrorist's iPhone For FBI
technology,Airlines Work Together To Declare War On Cyber Attackers
technology,Aaron Swartz Suicide: Reddit Co-Founder Dead At 26
technology,WATCH: 60 Seconds of Social Media
technology,Review: New Apple TV Is Bursting With Potential
technology,New 'Star Wars Battlefront' Trailer Reveals Massive Aerial Battles
technology,Thousands Are Watching A Virtual Deer Run Amok In 'Grand Theft Auto V'
technology,American Women Are Getting More Sleep Than Men
technology,EXPERTS: Ashley Madison Hack Data Is Real
technology,Family Of Paris Terror Victim Sues Social Media Companies
technology,Apple CEO Tim Cook: 'Accessibility Rights Are Human Rights'
technology,Facebook's Small New Update Is Actually Pretty Huge
technology,Google Casts A Big Shadow On Smaller Web Sites
technology,NY Tech Scene -- Rising (Week of 10/22/12)
technology,China Poised For Crackdown On Internet
technology,The World of 'Makers' Revealed by Wired's Chris Anderson
technology,Samsung Just Unveiled Its Thinnest Phone Ever
technology,Boston Marathon Bombing Victim Halloween Costume Prompts Online Fury
technology,The Dark Meaning Behind The Word 'Robot'
technology,"To Protect Your Privacy, Avoid Sharing These Things Online"
technology,This Is The Robot Dallas Police Used To Kill Shooting Suspect
technology,Yelp Helps You Avoid Hipsters And Yuppies In Your City
technology,Magic Printer Produces Its Own Paper
technology,Man Could Get Locked Up IRL For Sending Spam Messages On Facebook
technology,The 'Pokemon Go' Servers Went Down And People Totally Freaked Out
technology,Another Tech Giant Is Getting Into The Self-Driving Car Game
technology,Yahoo Boss Marissa Mayer Gives Birth To Identical Twin Girls
technology,Feds Unlock New York iPhone And Drops Case Against Apple
technology,AT&T Upgrade Fee To Double On February 12
technology,Why Silicon Valley Should Write Chile a Much Deserved Thank You Note
technology,"iPhone 5 Release Date And Video, iPad Mini, And More: This Week In Apple Rumors"
technology,Apple's iPhone 5 Crisis: A Data Vampire on the Loose
technology,60 Seconds of Social Media
technology,Electronic Security A Worry In An Age Of Digital Espionage
technology,This Dell Laptop Never Worked. How About A Refund?
technology,Former DHS Director Chertoff: 'You Can't Have Privacy Without Security'
technology,Apple To Replace Some iPhone 6 Plus Models Over Faulty Cameras
technology,Re/Code: Twitter Plans Layoffs Next Week
technology,Why Air Travel Still Sucks
technology,"Peter Thiel Could Invest In AirBnb, Valuing It At $2.5 Billion"
technology,On the Timing of iOS's SSL Vulnerability and Apple's ‘Addition' to the NSA's PRISM Program
technology,Spotify May Reserve Some New Music For Paying Subscribers
technology,Google Privacy Policies To Be Probed By EU Privacy Regulators
technology,Fired Google Engineer Blames Diversity Zealots For His Dismissal
technology,Crash Shows Google's Driverless Car Has Room To Improve
technology,SXSW Held A Ridiculous Gamergate Panel
technology,"Apple Leads The Charge on Security, But Who Will Follow?"
technology,Uber Fires Self-Driving Car Chief At Center Of Court Case
technology,Amazon Has 12 Amazing Days Of Deals That You Don't Want To Miss
technology,"Wavii, Summly Apps Serve Up Summarized News On The Go"
technology,eHarmony Wants To Set You Up... With Your Next Job
technology,Memo to Small Business: RingCentral Will Take Your Calls
technology,Even Google Is Waiting On The DMV
technology,Google Glass' Potential
technology,WATCH: The 4th of July Goes Mobile
technology,Apple's Case Just Got Boosted By Some Very Powerful Allies
technology,HBO Now Comes To Verizon
technology,"Artificial Intelligence Is Here To Help Us, Microsoft Boss Jean-Philippe Courtois Says"
technology,Microsoft Launches Office 2016
technology,Sneak Peek: HuffPost Brings Real Time Collaboration to the Newsroom
technology,"Facebook Warns Growth To Slow, Stock Tumbles"
technology,PRISM Spying Denials From Tech Companies Baffle Security Experts
technology,Girl Power: How Remote Work Can Help Shrink Tech's Gender Gap
technology,Thoughts About SXSW
technology,Video Games Rarely Warn For Smoking The Way They Do For Violence
technology,Here's What We Talked About Most On Facebook In 2015
technology,Facebook Lifts Ban On Rival Network Tsu
technology,The Smartphone Physical: Checkup of the Future?
technology,'Professor Astro Cat' Is The Educational App Kids Will Actually Want
technology,"This Valentine's Day, More Americans Are Searching For Love Online"
technology,"With Danger Lurking Around Web, FB Leaves Teens' Privacy Doors Ajar"
technology,Silicon Valley Veteran Says Tech Giants 'More Powerful Than AT&T Ever Was'
technology,Apple Says It Cares About Diversity. Facts Say Otherwise.
technology,Here's What U.S. Cities Googled The Most In 2015
technology,All It Takes To Buy A Stolen Password On The Internet Is 55 Cents
technology,This Is The Worst Coupon Of All Time
technology,"Mike Lynch, Autonomy Founder, Says HP Allegations Don't Add Up"
technology,Why Not Everyone Wants The Latest iPhone
technology,How A Digital Divide Leaves Parts Of Rural America Isolated
technology,Google Maps Quest: Google Releases 8-Bit Version Of Mapping Tool For April Fool's Day (VIDEO)
technology,"This Holiday Season, What Happens When All of Our Cultural Memories Go Digital?"
technology,Does The World Need A ‘Marshall Plan’ For Technology?
technology,Watch The Top 9 YouTube Videos Of The Week
technology,iPhone Gadget Turns Any Surface Into a Musical Instrument
technology,"UC Berkeley Alerts 80,000 People After Cyber Attack"
technology,YouTube Boosts Female Content Creators With Two New Initiatives
technology,Enterprise Software: Simplicity Drives Customer Benefit
technology,Burger King Twitter Account Hacked
technology,Too Much to Do and What to Do About It
technology,How To Hide From Face-Detection Technology
technology,Are We All Digital Diplomats?
technology,FCC Can Free the Cities
technology,"RIP, MS Paint"
technology,Yet More Evidence Of A Yahoo-Tumblr Mega Deal
technology,This Anti-Bullying App Helps You Brighten Someone's Day In Seconds
technology,Police Tracking Of Cellphones Raises Privacy Fears
technology,Massive Tinder Photo Grab Is Latest Scary Warning To Be Careful What You Post
technology,Apple Could Withdraw Help In Drug Case If FBI Hacks iPhone
technology,Why It's Taking So Long To Get More Electric Cars On The Road
technology,A Funeral for Online Appropriateness
technology,Tea Leaves on Comcast's Bid for Time Warner
technology,Meet The Man Who Uncovered The Target Hack
technology,Snapchat's Bob Marley Filter Called Out For Being 'Digital Blackface'
technology,Here's What New York City's Boroughs Should Look Like If They Were Redrawn Today
technology,10 Surprising New Twitter Stats to Help You Reach More Followers
technology,WATCH: Twitter's Plan for TV Domination
technology,"World's Most-Used Passwords Are Still Awful, According To 2015 Data"
technology,Deals You Can Still Get Before Amazon's Christmas Shipping Deadline
technology,NY Tech Scene - Rising
technology,You're an Internet Celebrity: Deal With It
technology,Why Refrigerators Should Stay Forever Dumb
technology,Facebook Tightens Rules On Who Can Cash In On Ads
technology,"46 Best Vines Of The Week, In One Video: Aug. 17 - Aug. 25, 2013"
technology,Prediction: Facebook Hits 2 Billion Users in 2014
technology,Sheryl Sandberg Sets Aside $100 Million In Facebook Stock To Give To Charity
technology,Feds Want To Know Why Android Updates Are So Slow
technology,Your Arm Might Be The Keyboard Of The Future
technology,A Commodore Computer From The 1980s Is Still Heating Schools In Michigan
technology,Apple Turns World's Oldest Catcall Into Product Demo
technology,The Changing And Terrifying Nature Of The New Cyber-Warfare
technology,"iPhone 5, iTV Release, And New iOS Maps: This Week In Apple Rumors"
technology,iPad Mini With Retina Display Coming This Year? 8-Megapixel Camera On Cheap iPhone? This Week In Apple Rumors
technology,Kate Middleton's Wedding Dress: The Debate Over What Qualifies For A Wikipedia Article
technology,Twitter Warns Users To Change All Their Passwords After Finding Bug
technology,Google Will Team Up With Ford To Build Self-Driving Cars: Report
technology,What Eduardo Saverin Owes America. (Hint: Nearly Everything.)
technology,Apple's New iPhone Blazes Past Previous Record
technology,Facebook Temporarily Killed Off A Lot Of Its Users
technology,LinkedIn Users Might Want To Change All Of Their Passwords ASAP
technology,Many Rural AT&T Customers Still Lack High-Speed Internet Despite Merger Promise
technology,Hasbro Doesn't Want Kids To Turn Into iPhone Zombies
technology,Yahoo Intern's New Logo Design Was Way Better
technology,Own A Vizio Smart TV? It's Watching You.
technology,The Idea and Itinerary
technology,Watch The Top 9 YouTube Videos Of The Week
technology,Everything You Need To Know About Windows 10
technology,Hackers Shaking Down Pennsylvania Democrats and U.S. Progressive Groups
technology,Hacked Companies Fight Back With A Controversial Move: Retaliation
technology,Cola Messenger Is Like Text Messaging On Steroids
technology,"Power Companies Could Use Drones To Save Lives, Cut Costs"
technology,Dallas Police's 'Bomb Robot' Raises Sticky Questions
technology,How Pirates And Hackers Worked Together To Steal Millions Of Dollars In Diamonds
technology,"Linus Torvalds, Linux Creator, Talks Storage Technology, Compares Hard Drives To 'Satan'"
technology,7 Places Where You Shouldn't Play 'Pokemon Go'
technology,"After Brexit, U.K. Residents Google 'What Is The EU?'"
technology,Let's All Take Responsibility for a Better Internet in 2013
technology,WATCH: The Major Problem With Dating Apps
technology,The Man Behind The Mac OS Is Working On A Mystery Startup With Other Ex-Apple Employees
technology,Magical Thinking
technology,'Pebble Seizure Detect' Is A Brilliant Use For Smartwatches That Could Save Lives
technology,"iPhone, iPad Ban Is Overturned By U.S. Trade Rep"
technology,Facebook Removed More Than 500 Million Fake Accounts In First Quarter Of 2018
technology,"'Uncharted 4' Director Bruce Straley Talks Diversity, Storytelling Tips And More"
technology,This Super-Smart Bus Drives Itself
technology,"In A Twist, Kim Kardashian Gets People To Click Away From Instagram"
technology,Tim Cook Says EU Ruling On Apple's Irish Tax Is 'Total Political Crap'
technology,"Amazon Lashes Out At Competitors, Banning Apple TV And Chromecast"
technology,"Cyber Spying Collaboration Discovered Between Shanghai Jiaotong University, People's Liberation Army"
technology,"Yahoo Cyber Indictment Shows Kremlin, Hackers Working Hand-in-hand"
technology,EU Ax Set To Fall On Apple
technology,"YouTube April Fools 2013: Video Sharing Website Will Shut Down, Announce Winner In 2023 (VIDEO)"
technology,iPhone 5S Release And A Possible (Not Possible) Launch Date: This Week In Apple Rumors
technology,Mom Is Really Excited About The New iPhone's '3D Touch'
technology,The Mac Startup Sound Is Gone
technology,"Tim Cook: If The FBI Gets What It Wants, It Will Threaten Public Safety"
technology,"iPhone 6 Appears, Apple Television Doesn't And COLORS! This Week In Apple Rumors"
technology,The Invisible Girl and Why Women Technologists Are Invisible
technology,DOJ Says It Hacked Into Encrypted iPhone -- Without Apple's Help
technology,"Apple, Facebook Come Out Against Controversial Cybersecurity Bill"
technology,Is Samsung About To Eat Apple's Lunch?
technology,Kentucky Tornado Victims Flock To Facebook For Helping Hand
technology,Don't Buy Your Rich Friends A Tablet For Christmas
technology,Google Is Getting Rid Of Its Creepy Humanoid Robots
technology,These Are The Tech Companies Supporting Apple Against The FBI
travel,8 Places That Will Be Totally Empty During The Super Bowl
travel,Your Weekly Travel Zen: Thailand
travel,Time Travel Is Possible:  We Did So in the Czech Republic and So Should Every Other American
travel,6 Hotels That Cater to Millennials
travel,The Strange Joy Of Visiting Foreign Hospitals
travel,7 Travel Apps For Thanksgiving And Holiday Travel
travel,5 Tips for Great Spring Skiing
travel,Olana: Walking Into Frederic Church's Hudson River School Paintings
travel,A Couple Of The World's Cutest Bus Stops
travel,Why Locals (and You) Will Love Copenhagen This Year
travel,Rambles In Western Ireland (PHOTOS)
travel,The Fess Parker Wine Country Inn and Spa is the most  romantic spot in the world
travel,"Best Travel Apps And Sites To Help You Plan Your Trip, Handle A Layover And Find Out Where To Go Next"
travel,Japan's Earthquake Coast Emerges From The Nightmare (PHOTOS)
travel,America's Most Scenic Roads
travel,Some Lifeguard Towers Are As Attractive As The Lifeguards Themselves
travel,Pyrenees Journal I: Homage to Catalonia
travel,The Judgement Of Paris Reenacted For Luxury Travelers
travel,Airport Amenities That Make Everything Better
travel,"Following A TV Series To Its Source In Cornwall, England"
travel,The Quieter Side Of Provincetown
travel,Guatemala: A 22-Mile Trek to Lago Atitlan
travel,A Yacht With A Conscience (PHOTOS)
travel,"Cow Jams in Uzbekistan: Adventures in Mongol Rally Land, Episode 3"
travel,Man Overboard! Cruise Ship Passengers Lost at Sea
travel,7 Travel Rules You Should Definitely Ignore
travel,Spanish Tourist Rodrigo Ben-Azul Stranded For Two Months In Chile's Santiago Airport
travel,13 Adventurous Hiking Tales
travel,10 Of The World's Best Observation Decks (PHOTOS)
travel,"Best Days To Buy Plane Tickets Are Saturday And Sunday, Study Finds"
travel,A Simple Story of Mind-Blowing Customer Service
travel,A Love Affair With an Island I've Never Met by Ian Madover
travel,Five Things You Should Do in the Caribbean Before You Die
travel,Why I Gave up On Vacations To Travel The World
travel,The 10 Cheapest Countries To Fly In
travel,America's Healthiest Cities To Visit (PHOTOS)
travel,The Best Road Trips From Miami (PHOTOS)
travel,Splurge-Worthy Trips For Your Tax Refund (PHOTOS)
travel,Life Vest vs. Seat Cushion: Which Will Save You? (VIDEO)
travel,"Todd Carmichael, Host Of Travel Channels 'Dangerous Grounds,' Survives Near Death Experience In Colombia (PHOTOS)"
travel,Secrets Of A Hotel Tea Master
travel,Tokyo Is Our Travel Tuesday (PHOTOS)
travel,"Byblos Brims With Culture, History and Life"
travel,Paris Shadows
travel,15 Hours Overnight at Seoul's Incheon Airport With Kids
travel,"Joel Slaven, Animal Trainer & Show Producer, Talks What It Takes To Put On A Show At SeaWorld, Busch Gardens & The Columbus Zoo"
travel,Tips For Visiting Myanmar Now (PHOTOS)
travel,Famous Sights Then And Now: The Colosseum (PHOTOS)
travel,Don't Tell! These Restaurants Are Where Locals Eat in Florence
travel,Great White Shark Cage Diving In South Australia (VIDEO)
travel,Top Ski Resort Spas (PHOTOS)
travel,Your Weekly Travel Zen: Lighthouses
travel,Jesse Tyler Ferguson Posts Airplane Instagram On The Way Home From New Zealand
travel,5 Reasons Why You Should Travel Thailand in Time of Crisis
travel,5 Ways to Travel More Spontaneously
travel,Soweto By Bike (PHOTOS)
travel,America's Strangest Museums (PHOTOS)
travel,Pack Your Purell Before You Visit The World's 'Filthiest' Tourist Attractions
travel,Pint-Sized Portland
travel,Rounding Up South Africa's Best: The High-End Way
travel,13 Easy Ways To Save On Trips To Europe
travel,On Whether India Is A Safe Destination For Solo Women Travelers
travel,The Unexpected Beauty Of A Viennese Ball (PHOTOS)
travel,Hotel Cheval In Paso Robles Is A Derby Winner
travel,"The Magic of Madras, The Charm of Chennai"
travel,7 Reasons Not To Make A Bucket List
travel,Texas Hill Country Swimming Holes (PHOTOS)
travel,Lisbon In Three Hours And The Art Of Layover Tourism
travel,Can You Be Too Old To Travel?
travel,"Priorat -- Majestic, Spiritual and Aiming Closer to Their Great Potential"
travel,"A Picture Postcard From Table Mountain National Park, South Africa"
travel,"In Italy, Eat, Pray, Run"
travel,This Is Why I Travel -- Despite Sometimes Ending Up Lost in a Sex Shop
travel,5 Hotels For Pick-Up Artists (PHOTOS)
travel,What's New In France In 2013
travel,5 Amazing Adults-Only Retreats (PHOTOS)
travel,Behind The Scenes With A Hotel Towel Thief
travel,10 Great Fall Festivals
travel,"Man Pens Witty, Kind Letter And Airline Actually Drops His Fee"
travel,Hotels For Modern Mad Men (PHOTOS)
travel,"Our Travel Budget Is Out of Proportion to Our Income, and We're Okay With That"
travel,Explore America: Nebraska's Prairie 'Chickens And Stars' Event (PHOTOS)
travel,Thailand Journal: The Julian Schnabel of Chiang Rai
travel,An Idiot Abroad As Well: My Travel Diaries
travel,Festive Foods: What The World Eats At The Holidays
travel,"Journey Across Russia, From Moscow To Novosibirsk: A Personal Search For Family History & Good Vodka"
travel,8 Cultural Differences Between America And Other Countries
travel,5 Retreats For That Brilliant Brain Of Yours
travel,The Gathering: Ireland's Cynical Play For Irish-Americans Money
travel,15 Best Beaches for 2014
travel,"Sochi, Russia's Olympic Host City, Remakes Itself As A Winter Destination (PHOTOS)"
travel,"American Airlines New Look: Company Unveils New Logo, Aircraft Changes"
travel,The World's Friendliest & Least Friendly Cities (PHOTOS)
travel,The Magical Colors of Cartagena de Indias
travel,Tourist's Comedy Gets Stone-Cold British Guard To Crack A Smile
travel,Sometimes the Best Part of Traveling Is Coming Home to a Really Excited Dachshund
travel,Road Trip Through Wild Wild Florida. Part II
travel,Who Volunteers in Haiti?
travel,The New Discovery Route in Wine Coast Country
travel,When Letting Go On Vacation Isn't Easy
travel,Empire State Building's Secret 103rd Floor (PHOTOS)
travel,An Abandoned Adventure Is In Your Own Backyard (PHOTOS)
travel,6 Stellar Summer Patios In The U.S. (PHOTOS)
travel,Fortnighter's 2013 Travel Essentials (PHOTOS)
travel,The Norwegian Town Whose Name Is One Letter Long
travel,America's Coolest Hipster Hotels (PHOTOS)
travel,"Love In Berlin, Europe's Naughtiest City"
travel,"Wall Drug, South Dakota's Most Famous Road Trip Pit Stop, Loves Billboards (PHOTOS)"
travel,I Saved $25K In College To Take A Year Long Trip Around The Globe
travel,Thailand Journal: Massage and Elephants
travel,The Paia Inn on Maui's North Shore
travel,"Entrepreneurs, Sit Back and Relax! You Deserve It!!"
travel,7 Most Outrageous Travel Fees and How to Prepare for Them
travel,Guide To Highway 1 -- Sunset Magazine Highlights A California Staple
travel,"Amman, Jordan: Dining In The City Of Seven Hills (PHOTOS)"
travel,Are 'Dronies' The New Selfies?
travel,The Tides of March
travel,6 Essential Reasons To Book A Trip With A Travel Agent
travel,Ireland From Coast to Coast in Four Days
travel,45 Park Lane London: LuxEcoLiving's Best Hotels in the World
travel,The Real-Life Places Behind Your Favorite Desktop Backgrounds Revealed
travel,The Best New Hotels of 2013 to Add to Your Travel Bucketlist
travel,Montreal Journal IV: Erabliere
travel,A Different Kind Of Buenos Aires Vacation
travel,Dreaming of My 2014 Travels: Venice
travel,I Tried The Vegas Hangover Bus (PHOTOS)
travel,Hanging Out In A Japanese Monkey Park (PHOTOS)
travel,America's Most Irish Towns
travel,'Monster' Cruise Ships Threaten Venice On Costa Concordia Anniversary
travel,10 Things to Do Instead of Watching the Super Bowl
travel,10 Tips For A Successful Trip To France
travel,These Photos Take You Inside One Of The World’s Largest Cruise Ships
travel,Surviving a Water Landing
travel,The One Thing That Nearly All Air Travelers Agree On
travel,10 Amazing Works Of Architecture To Visit (PHOTOS)
travel,The Best Dance Spots In Amsterdam
travel,10 Autumn Trips Not To Miss (PHOTOS)
travel,10 Florida Tours To Float Your Boat (PHOTOS)
travel,How To Navigate Morocco's Souks
travel,Provence's Pont du Gard and the Greatness of Ancient Rome
travel,Salina Turda Salt Mine Sounds Boring But Is Really An Amazing Attraction
travel,Chiapas: From Prehistoric Amber to Subcomandante Marcos and the Zapatista Liberation Army
travel,"Beat The Summer Heat: How To Celebrate Nude Recreation Week, July 9-15"
travel,Seven Sweet Spots For Spring Savings (PHOTOS)
travel,Historic Resorts: The Grande Dames Of The South (PHOTOS)
travel,Track Records: Yekaterinburg And The Asian Frontier
travel,"In A World Of Male Hotel General Managers, Shan Kanagasingham Stands Out"
travel,8 Travel Resolutions for 2014
travel,Is the Water at the Beach Safe? How to Find Out Before You Take the Kids
travel,How to Make a Mixtape for the Road
travel,"Love Letters: Deerfield, WI"
travel,Saving Sea Turtles: Check Out My Adventures in French Polynesia
travel,Félicité Island Is The Perfect Remote Escape
travel,8 Other Great Emerald Isles
travel,The Iditarod: Mushing With The Best In The World
travel,Walking Towards the Sun God
travel,"Delta Flies University Of Florida Basketball Team, Bumps Regular Passengers (VIDEO)"
travel,How to Speak English Like the Irish On Paddy's Day
travel,Everything You Want to Know About Holiday Travel (But Were Afraid to Ask)
