label,text
business,The Hardest-Working Towns In America: Report
business,"Given Uber's Past Troubles, This Should Come As No Surprise"
business,The Most Ridiculous Things To Come Out Of CEOs' Mouths In 2012
business,Beer Drinking Down After Manufacturing Job Cuts
business,"Women in Business: Cynthia Kersey, CEO of The Unstoppable Foundation"
business,Labor's Day Remembered
business,What Should I Do if an Employee Is a Liar?
business,"In Business, Don't Be Afraid to Shake It Up"
business,JPMorgan CEO Asks For Help With Data Breaches
business,The Rich Get Richer
business,The Rhythm of the Business Dance: 6 Essential Steps of Pattern Recognition
business,"Gender Diversity on Boards: Good, Bad or Indifferent?"
business,Price Wrong and Lower Your Profits
business,"U.S. Economy Added 215,000 Jobs In March"
business,5 Incredible Reasons We Are Petrified of Cold Calling and Overcoming Them in 3 Simple Steps
business,11 Worst Predictions Of The Year
business,32 Data Breaches Larger Than Sony's in the Past Year
business,"Cab Driver Returns $300,000 Left Behind In Back Seat"
business,Workers Seeking Productivity In A Pill Are Abusing ADHD Drugs
business,Federal Reserve Accidentally Leaks Secret Documents
business,Can Chevron Avoid Paying Clean-Up Costs By Hiding Behind Shell Companies? A Canadian Judge Seems To Think That's Just Fine...
business,Bad News For Veterinarians
business,The Need for Private-Public Partnerships Against Cyber Threats -- Why A Good Offense May be Our Best Defense.
business,"Women in Business Q&A: Dawn Fotopulos, Founder of Best Small Biz Help"
business,Marketing Evolution Is Failing In The C-Suite
business,"Women in Business: Three Generations of Women in Radio: Renee Roth, Jo-Ann Silverstein and Rachel Roth"
business,U.S. Postal Service Right To End Era Of Saturday Delivery: Poll
business,Move the Crowd
business,Americans Are Getting Even More Pretentious About How They Drink Coffee
business,Enough About Disruption: We're in the Golden Age of Communications
business,Big Isn't Always Better
business,STEM Selling: Beautiful Women Conquering New Territories and Old Stereotypes
business,Trump Pays Penalty For Ethically Questionable Political Donation
business,Why China Has A Love/Hate Relationship With Social Media
business,"Walmart Strike Hits 100 Cities, But Fails To Distract Black Friday Shoppers"
business,Industry Leaders Discuss Digital Workforce Of The Future At Davos
business,"Creating a Structured, Repeatable Process for Innovation"
business,"Marijuana Vending Machines, Stoner Fantasy, May Become Industry Norm"
business,Giving in America - a Winning Situation
business,Let's Redefine 'Smart Money'
business,A Man With Cerebral Palsy Was Left To Crawl Off A United Plane
business,Nine CEOs Pushing Workers To Vote For Romney
business,"What Twitter Founder, Jack Dorsey, Teaches Us About Marketing"
business,Krugman: It's Time To Put 'Delusional' Austerity Beliefs Behind Us
business,Global Business Leaders to the Rescue!
business,Tesla Won't Let You Use Its Self-Driving Cars For Uber
business,"'Health Is Wealth' Panel At Davos: Arianna Talks With Francis S. Collins, Paul Bulcke, Joseph Jimenez And Mauricio Cárdenas"
business,9 Sustainability Lessons from Climbing Mt. Kilimanjaro
business,Decoding the New Face of America: An Interview With dlR USA CEO Carlos de León
business,10 Retailers With the Worst Customer Service
business,"Francois Hollande: In Greek Crisis, 'There's No Time To Lose'"
business,Obamacare Website Woman Mysteriously Disappears
business,"USDA Spares Poultry Workers Faster Line Speeds, But Hog Workers May Not Get So Lucky"
business,6 Leadership Lessons From An Historic Presidential Election
business,"Getting It Done: How to Be Strategic, Creative and Productive"
business,It Was Only A Matter Of Time Before The World Got A Marijuana Food Truck
business,Theranos Voids Two Years of Edison Blood-Test Results
business,Foreclosure Settlement With Major Banks Delayed For Congressional Review
business,10 Steps to Fight Inertia
business,The Creative Class With Peter Marino
business,10 Jobs Disappearing From America: 24/7 Wall St.
business,Facebook Plans To Crack Down On Some Race-Based Advertising Techniques
business,Jack Dorsey Still Won't Say If He'll Be Twitter's Permanent CEO
business,"Women in Business Q&A: Jenny Q. Ta, Founder, Sqeeqee"
business,Verizon And Unions Reach 'Tentative Agreement' To End Strike
business,"Birth Control Is Free Under Obamacare, But Not Everyone Got The Memo"
business,4 Secrets To Great Meetings From Silicon Valley Greats
business,Can a Nonprofit Organization Have a President/CEO and an Executive Director?
business,Oil Baron's Descendants Shame Exxon Mobil For 'Morally Reprehensible Conduct'
business,"Women in Business Q&A: Paula Long, Chief Executive Officer and Co-Founder, DataGravity"
business,10 Clues That an Entrepreneur Is in Over His Head
business,4 Ways A Bad Boss Hurts Productivity
business,What Your Work Lunch Really Says About You
business,"Banks Say No To Marijuana Money, Legal Or Not - NYTimes.com"
business,Dr. Francis Collins: 'There Is An Uneasiness' About Evolution
business,Why Women Need To Stick Together At Work
business,Chobani To Start Offering Paid Family Leave To All Its Employees
business,10 Worst Job Markets In The U.S.: 24/7 Wall St.
business,Global Travel Needs to Be Part of the Solution
business,Otto Scharmer Shares What You Can Do For A Few Hours Each Day To Revolutionize Your Brain
business,The House Just Voted To Give Wall Street Billions From Americans' Retirement Savings
business,"How Crazy Rich You'd Be If You'd Invested in Chipotle, Starbucks And More"
business,"Micro Living Trend Sweeps The U.S., As Cash-Strapped Renters Look For Affordable Housing In Pricey Cities"
business,Larry Summers Was Offered Job As Head Of Bank Of Israel
business,Philip Morris Says It's 'Trying To Give Up Cigarettes' In 2018
business,Delta Under Fire After Pilot Appears To Hit Passenger
business,How to Manage Your Personal Brand
business,Cities That Work for Everyone
business,Best-Paying College Majors Are Mostly In Engineering: Forbes List
business,Could Coffee Be an Apt Symbol for Innovation?
business,The Value of a Dollar in Every State
business,"New Jobs For Lawyers, Coders, And Everybody Else"
business,Ron Bruder: 'There's A Social And Structural Barrier' Toward Women
business,What Do Goldman Sachs and the St. Louis Cardinals Have in Common With Your Business?
business,"If You Were a Horrible Boss, Would You Even Know It?"
business,John Mackey Obamacare Remarks Off-Target In New Way
business,Verizon Could Buy Yahoo In The Next Few Days
business,CEO Who Led Indiana Boycott Supports Confederate Flag Removal
business,Corporate's Responsibility Toward Social Sustainability
business,Imran Ali Khan: Align Your Profession With Your Passion
business,"AT&T's Fiber Optic Construction Last Six Years -- $140 Billion, or One Slice of Pizza and ""FiberHype""?"
business,This Is The First 10 Years Of Your Career
business,11 Million Volkswagens Were Fitted With Software At Center Of Emissions Scandal
business,Why You Should Lead Outside In Instead Of Inside Out
business,Falling in Love With the Mission and Other Sage Advice for a First Time Nonprofit Director
business,Financial Journalism: Best of 2014
business,Gas Selling For 47 Cents A Gallon As Oil Prices Drop Sharply
business,We Ain't Germans
business,"Women in Business Q&A: Christyn Wilkins and Callie Brackett, We Tie the Knots Founders"
business,Arianna Talks Jobs On ABC's This Week
business,Noah's Ark Theme Park Plans To Only Hire People Who Believe Biblical Flood Actually Happened
business,When Prophecy Fails - NYTimes.com
business,"Women in Business Q&A: Eileen Campbell, CMO, IMAX"
business,America Inc. Needs Attitude Adjustment to Reach Full Potential Abroad
business,"Job Growth Slows In Last Two Months, Unemployment Still 5.1 Percent"
business,"Loving Your Job: Are You a Starter, Builder, Fixer, or Runner?"
business,The World Could Get A Third Of Its Energy From Renewables By 2030
business,The Most Popular American Brands In China: 24/7 Wall St.
business,"Mark Pincus, Zynga CEO, Lost $4 Million Per Day"
business,How Amazon Is Holding Seattle Hostage
business,Why Bosses Should Snoop On Employees Less
business,Pfizer Won't Let Its Drugs Be Used In Executions Anymore
business,Using the Right Innovation Tool for the Right Innovation Job
business,11 Surprising Habits Of Powerful People
business,Federal Reserve's Jeffrey Lacker: Exit From Bond-Buying Program Should Be 'Quick'
business,The World's Worst Economies: 24/7 Wall St.
business,My Conversation With Robin Sharma
business,9 Things Successful People Won't Do
business,America Just Turned In Another Stellar Jobs Report
business,THE CFPB Launches No-Action Letters for Financial Innovations
business,Beware! A Majority of Job References Don't Say Good Things
business,"Why a Picture Is Worth 1,000 Words: Using the Power of Visualization to Achieve Your Goals"
business,MasterCard Wants You To Pay For Stuff With Selfies
business,These 5 Companies Are Trying To Spark A Parental Leave Revolution
business,"Loving, the Key for Wise Leaders"
business,Back to School Lessons for Growing Business
business,"Women in Business Q&A: Laura Tenison, Founder and Managing Director, JoJo Maman Bébé"
business,Women in Business Q&A: Sue Sears is Vice President of Global Diversity & Inclusion at Kimberly-Clark Corporation
business,"For-Profit College Industry, in Freefall, Convenes in Florida"
business,"Women in Business Q&A: Star Jones, President, Professional Diversity Network"
business,Sriracha Founder: Factory Shutdown Could Have Led To Bankruptcy
business,Warren Buffett: Congress Is The Biggest Problem Facing Obama In His Second Term (VIDEO)
business,"Samsung Halts Production, Sales Of Galaxy Note 7"
business,Animal Lovers Are Going To Be Moo-ved By Panera's Big Announcement
business,Succession Planning for Business: What You Need to Know Now About the Call You Never Want to Make
business,My Thanksgiving: A Turkey Sandwich at Walmart
business,This Elusive Thing Called Branding And Why It's So Hard To Get
business,Inside The Tank: Mr. Wonderful On Building Empires
business,Making More Jobs in Our Economy -- The Secret Sauce
business,Amazon May Take Over Some RadioShack Stores
business,Slump In Financials Sends Wall St. Lower
business,Creating A Gateway For Innovation And Commerce In The Caribbean
business,Marketing Problems? Identify the Grey Areas for Solutions
business,For-Profit College Regulations Struck Down In Part By Federal Judge
business,"Average Student Loan Debt Could Cost A Household $208,000 Over A Lifetime: Study"
business,Your Career - Paved Road or Tall Grass?
business,How Much Time Do You Waste In Meetings?
business,I Want to File Bankruptcy
business,Brand Clash: Coca Cola Making Milk and Apple Making Cars
business,Nonprofit Risk and Crisis Management: Challenges for the 21st Century
business,Here Are The Manufacturers Bringing The Most Jobs Back to America
business,"Women in Business Q&A: Donna Moyer, CEO, Preferred HealthStaff"
business,8 Companies That Owe Workers A Raise
business,Perdue Wants To Give Its Chickens Better Lives
business,What I Learned About Business From Making Art
business,Tesla CEO Elon Musk: Billions Coming For Battery Business
business,5 Ways Resilient People Use Failure to Their Advantage
business,Do Home Buyers Need a Pre-Approval?
business,This Woman Created A Resume For Airbnb And It Went Viral
business,Krugman: Conservatives Are 'Terrified' Of Piketty
business,When Managers Go Helicopter: How to Deal With a Hovering Boss
business,Coke Has To Put On The Red Light
business,The 5 Most Hated Companies In America: 24/7 Wall St.
business,Twitter Has Suspended 1.2 Million Accounts For 'Terrorist Content'
business,How (Not) To Prevent The Next Big Financial Bubble
business,America's Most Affordable Housing Markets: 24/7 Wall St.
business,New Apple Store Makeover: Looks Aren't Everything
business,10 Most Expensive Cities To Buy A Home: 24/7 Wall St.
business,3 Reasons Obama's Oil Tax Would Be Good For America
business,Is the European Central Bank Playing With Fire?
business,Are You Burning Out Your Employees?
business,What Do Banks Have to Hide From CFPB's Efforts to 'Make the Market for Credit Work Better'?
business,Walmart Wants To Stick Groceries In Your Refrigerator While You're Away
business,Another Big Company Steps Up To Improve Maternity Leave
business,Why Tesla Didn't Release A Fully Driverless Car
business,Exxon Mobil Screwed Up Its Attack On Columbia For Climate Reports
business,When Did They Forbid Love?
business,Community Banks Are Failing; Pawnshops Are Growing
business,3 Steps to Curating Corporate Training
business,The Refreshing Reason Google's CFO Is Leaving
business,How A Little Tech Glitch Took Down The NYSE For 3.5 Hours
business,Read Contracts Carefully Before Signing
business,Wal-Mart To Challenge Amazon On Drone Delivery
business,How Wells Fargo Student Loan Consolidation Measures Up in the Refinancing Market
business,"Olympic Excellence Only Occurs With Teamwork, Flexibility And Gut Instinct"
business,WATCH: A Lesson In 'Burgernomics'
business,Now We Know Why Huge TPP Trade Deal Is Kept Secret From the Public
business,"Business, Bibles, and Gene Simmons"
business,Entrepreneurship in the British Virgin Islands with Stedman Graham
business,Pizza Receipt Shows Intense Vancouver Hockey Fan Canceled Pick-Up Because Game Was Tied (PHOTO)
business,9 Mergers That Epically Failed
business,"Women in Business Q&A: Roxane Divol, SVP and GM, Trust Services, Symantec"
business,IPO for All or How to Create Your Own Currency
business,Ex-Volkswagen CEO Charged In U.S. Over Emissions Cheating Scandal
business,Are Men More Controlling?
business,Jamie Dimon Goes To Washington: JPMorgan Chief To Appear Before Senate
business,Time for a Change of Business
business,Need A Job? Glassdoor Presents The Best Places To Work In 2013
business,How to Manage Executive Onboarding the Way McDonald's Brings in New Franchisees
business,"Women in Business Q&A: Victoria Tkacheva, Director of Events and Marketing, Pergola"
business,8 Restaurant Surcharges That Don't Make Sense
business,Why Smart Bosses Give Bad Employees a Raise
business,Driving Your Startup With Fear Has Bad Consequences
business,"Overcoming Fear, Managing Failure And Developing A Success Mindset"
business,Declining Population Could Be Hit To Global Economy
business,Why the Decrease in Unions and Defined Benefit Retirement Plans Hurts Us All
business,Hidden-Camera Video Reveals Chicken McNuggets' ‘Disturbing Secret’
business,Wall Street May See Opportunity In Marijuana
business,"Tax Avoidance Accusations Scaring Away Some Investors From Apple, Google"
business,"Daddy, Where Do Jobs Come From?"
business,These Internal Documents Prove Uber Is A Money Loser
business,The Art of the Redesign
business,Why Underwater Homeowners Won't Be Saved By Bank Of America's $17 Billion Deal
business,My Biggest Leadership Win: The Day My Life Stopped Working
business,How Using Tinder Made Me a Better Salesperson
business,Shattering the Glass Ceiling
business,Secrets Of The Yahoo Sale ‘Book’ Reveal Financial Meltdown And Big Bet On Mobile Voice Search
business,"Fossil Fuels Are A Terrible Investment, And They're Only Going To Get Worse"
business,Customer Service and The Happiness Factor
business,How to Forecast the Environment for Success
business,Solar Energy Just Eked Out A Major Win In California
business,American Apparel Stores To Close After Canadian Purchase
business,Should Restaurants Open Christmas? HuffPost/YouGov Poll Finds Most Americans Say No
business,Here's What's Really Holding Back The Economy
business,Hacking the WIN-Win-Win Business Model
business,"Remy Martin's 2,500 Euro Louis XIII Cognac In Demand From Asia's Super-Rich"
business,Wells Fargo CEO John Stumpf Resigns In Wake Of Bank Scandal
business,Buffalo Wild Wings' Secret To Success: Pouring A Lot Of Beer
business,"How Battles Over God, Guns And Gays Infiltrated Corporate America"
business,BMW Says It Hasn't Manipulated Emissions Tests
business,New York Medical Marijuana Program Begins -- And No One Is Excited
business,Everything Old Is New Again
business,How Sustainable Luxury Can Save The Planet
business,How to Future Proof Your Workplace
business,Hating Your Job Might Be Making You Sick
business,"Borgata Babes Lose Lawsuit: Waitresses Can Be Fired For Gaining Weight, Judge Rules"
business,Wall Street Is Losing Confidence In Exxon Mobil
business,The Secret About Professional Pot Dealers
business,Presidential Debates and Middle-Class Economics
business,Time Warner Cable's Advertised $89.99 Triple Play: Now $190.77. What the F@$#X$!?
business,The Challenge of Coming From the Outside to Take Over an Existing Team
business,Want to Fight New Forms of Financial Corruption? Hire Women.
business,Bigger Logos Make You Look Smaller
business,Do Directors View Their Nonprofit Boards Through Rose-Colored Glasses?
business,Fiscal Cliff Talks Could Spark Stock Market Volatility
business,Who's Winning: You Or The City? Take This Quiz To Find Out.
business,"St. Petersburg Police Headquarters Plan Scrapped, 'Peculiar Smelling' CSI Lab Lives On"
business,States Sending The Most People to Prison: 24/7 Wall St.
business,Starbucks UK Tax Allegations Hurting Brand
business,Georgia Kroger Has An Excellent Explanation For Its Unisex Bathroom
business,"Women in Business Q&A: Heather Gordon Friedland, VP, Local and Seller Experience, eBay"
business,Here Are Google's Secrets To Treating Workers Well
business,"Uber Paid Hackers $100,000 To Keep A Massive Data Breach Quiet"
business,GM Was Told About Safety Defects More Than 11 Years Before The Recall
business,Campaign For Investors -- Help for You
business,100 Facts About The Economy That Will Blow Your Mind: The Motley Fool
business,Walmart's Safety Vows At Odds With Reality
business,The Worst Companies To Work For In The U.S.: 24/7 Wall St.
business,45 U.S. Trade Groups Beg Trump: Don't Impose Tariffs On China
business,"Women in Business Q&A: Christine Wheeler, Founder and CEO of Drazil Foods"
business,Why You Never See Ronald McDonald Eating McDonald's Food
business,Shock and Awe
business,World Bank Sets 'Expiration Date' For Extreme Poverty
business,The Least Respected Companies In America: 24/7 Wall St.
business,Why Human Connectivity Wins Over Data: Uber vs. Twitter in Sydney
business,"Exxon Goes After Climate NGOs, Warns Them Not To Destroy Communications"
business,"Gerard Depardieu, Actor, Receives Russian Residency Stamp In Quest To Avoid High French Taxes"
business,5 Ways To Get To Know The Customer Of Tomorrow
business,Soon You Can Netflix And Chill From All Around The World
business,FedEx Pulls Startup Conference Sponsorship Over 'West Memphis Three' Speaker (UPDATED)
business,How Positivity Makes You Healthy and Successful
business,Time For Bitcoin to Come Out of the Closet?
business,Walmart Christmas Hours 2012
business,The White House Tries To Get Tough With Dodgy Colleges
business,6 SEO and Social Secrets Every Entrepreneur Must Know and Why
business,These Are America's Poorest States
business,"Europe Crisis: George Osborne, U.K. Finance Minister, Says Weaker Eurozone Countries Need Support"
business,"Bud Light Hopes Amy Schumer, Seth Rogen And Beer Help You Forget This Horrible Election"
business,Buffett-Heinz Deal Sends Urgent Warning To Food Industry To Cut Costs
business,Why You Should Stop Using To-Do Lists (and What to Do Instead)
business,"10 Jobs That Won't Be Taken By Robots, Yet"
business,Starbucks Offering Employees Free Legal Advice On Immigration
business,Change Management: 4 Factors That Distinguish Successes From Failures
business,3 Leadership Lessons From my 16-Year-Old Hipster
business,There's Rampant Income Inequality In Congress's Own Backyard
business,"Going Against the Flow: Brittany Hodak, Cofounder of ZinePak"
business,"For Hedge Funds, It's All in the Game"
business,Northeast Ohio and the San Francisco Bay Area Have More in Common than NBA MVPs and Championship Games
business,These Are The Counties Going Hungry In Every State
business,Top Factors for Improving Nonprofit Directors' Board Experiences
business,Can Nonprofit Management Usurp Board Responsibilities?
business,Walmart At 50: Website Serves As A Forum For Critics Of All Stripes
business,10 States Making The Most On Beer: 24/7 Wall St.
business,Abercrombie Is Finally Over Its Bizarre Obsession With Abs
business,Walmart Quits Selling AR-15s And Military-Style Rifles
business,Minimum Wage Raises Coming To 18 States On New Year’s Day
business,Health Insurer Cigna To Buy Express Scripts For About $54 Billion
business,Mediation Room At Boston Company Helps Workers Focus
business,5 Reasons The Cover Letter Should Just Die Already
business,Managing Innovation
business,10 Companies That Are Working To Hire Veterans
business,The Rise And Fall Of The Stapler
business,"High-Paying Job Listings Are Written To Attract Men, Study Finds"
business,Disrupting Disruption: Lessons For Innovation
business,Rhode Island Struggles With Enormous Pension Problem: 'The Titanic Is Going Down'
business,Is 'The World's Most Secretive Company' Opening Up?
business,U.S. Postal Service Alcohol Delivery Idea Criticized By Merchants
business,Success Is Never Final
business,The Cybercrime Scheme That Attacks Email Accounts And Your Bank Accounts
business,"Women in Business: Dawn Sweeney, President and Chief Executive Officer, National Restaurant Association"
business,How to Be an Entrepreneur Who Doesn't Suck
business,The Serious Price Of The Hyper-Convenient Economy
business,"Joe Ratterman, BATS CEO: IPO Debacle 'Completely Regrettable And Very Painful'"
business,"Women in Business: Arlinda Lee, PhD, Senior Healthcare Analyst, MLV & Co"
business,Here Are 5 Things To Be Thankful For This Thanksgiving
business,The Ultimate Guide To Finding A Mentor
business,How to Find Your Calling: 7 Beliefs to Change Right Now
business,"Who is an Employee, Joint Employee, or Independent Contractor?"
business,10 Ways to Spot a Truly Exceptional Employee
business,How to Improve Your People Skills
business,Airbnb Sues New York City
business,How to Become a Great Listener
business,A Business Model for Marijuana
business,Hershey: U.S. Income Inequality Is Transforming The Chocolate Business
business,Astronaut Scott Kelly Is Psyched About The Private Space Industry
business,Zombie Brands: The Science Behind Undead Market Icons
business,This Big Law Firm Just Stepped Into The 21st Century
business,Phil Mickelson Agrees To Pay Back Money He Made In Connection With Insider Trading Ring
business,Crafting the Cyprus Deal: A Road Filled With Blunders
business,Entrepreneurial Women:  3 Ways to Break Through Invisible Barriers to Growth.
business,Hedge Funds Are Richer Than Ever
business,Why the Best Marketers MUST Embrace Social
business,Chipotle Is Making Big Changes But Nobody Really Cares
business,Elon Musk Predicts The Cause Of World War III (And It's Not Donald Trump)
business,6 Ways to Improve Your Performance at Work
business,Billionaire GOP Donor Says Trump Could Create 'Widespread Global Depression'
business,Jamie Dimon On Meet The Press: We Were 'Dead Wrong' To Dismiss Trading Concerns
business,Uber Didn't Tell Its Drivers In Singapore Their Cars Had Been Recalled
business,"“I’m Sorry""--The Two Tragically Forgotten Words In Customer Service"
business,"Americans Eat 1,083,333 Football Fields Worth Of Wings On Super Bowl Sunday And Other Fun Facts"
business,Here Is The Most Popular Beer In Every Country
business,Bank Of America Back Door Bailout Comes To Light
business,"U.S. Adds 215,000 Jobs In July; Unemployment Rate Lingers At 5.3%"
business,American Apparel CEO Dov Charney On Bangladesh: Start Making Clothing In A Human Way
business,Amazon Workers Strike Again For Better Pay In Germany
business,"New Year, Same Old Banks"
business,Uber Has A Secret Program Called 'Greyball' It Uses To Evade Police
business,Twitter Is Reportedly In Sales Talks With Google And Salesforce
business,Yet Another Reason To Love Legos
business,"Killer Mike Wants You To Move Money Into A Local, Black-Owned Bank Before It's Too Late"
business,"On 5th Anniversary Of Lehman Collapse, Americans Still Angry"
business,"Rick Ross Wants You To Eat At His Restaurants, But Don't Bring Your Gun"
business,Rich People Have Access To High-Speed Internet; Many Poor People Don't
business,7 Hacks for the Ultimate Sales Meeting
business,New Jersey's Consumer Advocate Takes the Verizon-NJ Board of Public Utilities' 'Stipulation Agreement' to Court
business,The Future Is Blurry!
business,Bitcoin And Ethereum Divergence...
business,Nine Worst States To Get A Raise: 24/7 Wall St.
business,9 Bad Manager Mistakes That Make Good People Quit
business,eBay Bans Confederate Flags
business,Top Characteristics of a Great Leader
business,The One Thing the Best Leaders and Most Liked People Have In Common
business,What Firing An Employee Teaches You About Your Company's Culture
business,The Incredible Shrinking Labor Force
business,You Do Not Need To Buy This
business,One Of Donald Trump's Quietest Critics Just Called Him Out On Diversity
business,FedEx Admits That Not All Packages Made It In Time For Christmas
business,Walmart's Latest Move In Its War To Overtake Amazon
business,Paul Krugman: Paul Ryan's Budget Plan Is 'A Fraud'
business,9 Countries That Hate America Most
business,4 Lessons Prison Taught Me About Power and Control
business,Major Banks Aid In Payday Loans Banned By States - NYTimes.com
business,This Is What It's Like To Work For One Of America's Most Iconic Brands For 24 Years
business,Does a Carbon Tax Work? Ask British Columbia
business,Uber Sacks Driver After Passenger Records Vile Homophobic Rant
business,America's Most (And Least) Literate Cities: 24/7 Wall St.
business,IEX Wins SEC Approval As U.S. Stock Exchange
business,John Ratzenberger - American Made
