label,text
religion,Megachurch Pastor Abruptly Retires After Allegations Of Improper Conduct Go Public
religion,Why Is The Southern Baptist Convention Cutting Hundreds Of Jobs?
religion,The Pen and the Gun
religion,"Don't Weaponize Your Words (Devarim, Deuteronomy 1:1-3:22)"
religion,Pope Asks for Forgiveness
religion,"White Christian Allies, Talk About Race From Your Pulpits"
religion,Daily Meditation: Earth Day
religion,Christian Pathos vs. ISIS Pathos
religion,EU Advisor: It's Wrong To Ask Muslim Employees To Remove Headscarfs
religion,New Gods in Hollywood
religion,"Getting Unstuck (Second Shabbat of Passover, April 11, 2015)"
religion,Pope Francis Lands Near Washington For First Trip To The United States
religion,New Mexico Gov: 'Coward' Who Set Off Explosives Outside 2 Churches Will Be Caught
religion,This Mosque's Beauty Is Seriously Otherworldly
religion,The Inspiring Faith Journey Of A Transgender Latina
religion,Daily Meditation: Enlightened
religion,Musician Keb' Mo' Explains Blues Music's Connection To The Church
religion,Zen Temple In Japan Becomes First To Perform Same Sex Marriage Ceremonies
religion,A Lancet Breakthrough: Publishing About Faith and Health
religion,Muslims Of America: Chapter One
religion,Will Religious Freedom Advocates Oppose Roy Moore?
religion,A Ministry On Top Of The World
religion,Sikh Man Helps Reunite Christian Pastor With Stolen Bible
religion,White Supremacy As 2016's Urgent Faith Challenge
religion,Evangelical Climate Scientist Explains Why Christians Should Care About The Environment
religion,Egyptian Priest's Burial Painting Discovered 16 Years After Excavation Of Tomb
religion,"34,000 Sign Petition Against Archbishop Who Reportedly Invited Kim Davis To Meet Pope"
religion,Donald Trump Makes Strange Appeal To Evangelicals To Help Him Get Mormon Votes
religion,Why Religious Freedom Advocates Should Be Concerned About Sam Brownback
religion,Christian Conservatives Ponder A ‘Babylonian Exile' To Save Their Faith
religion,Confronting #WhiteSupremacy With #RevolutionaryLove
religion,Daily Meditation: Spiritual Sustenance
religion,Pope Francis Calls Assisted Suicide 'A Sin Against God'
religion,The World's First Permanent Death Cafe Could Soon Come To London
religion,Getting to Zero Hunger: faith in action
religion,Cheek Turning: Completely Impractical Words Jesus Spoke
religion,2017's Holiday Ads Will Make You Feel All Warm And Fuzzy Inside
religion,Pope: 'God Is Not Afraid Of New Things'
religion,'We' Are What We Believe
religion,Google This: Jean Vanier and What It Means to Be Human
religion,"""War Room"" Has The One Thing Many Christian Films Don't Have -- A Black Cast"
religion,America Needs An Anti-Semitism Monitor At The State Department
religion,SURVEY: Majority Supports Contraception Insurance Mandate
religion,Fighting For Our Sons In A Culture That Seeks To Destroy Them
religion,Pope Urges Using 'Weapons Of Love' To Combat Evil In Easter Message
religion,Daily Meditation: Be Brave
religion,Cardinal: Boko Haram Has Shamed Nigeria
religion,Jewish Artist Turns Swastika Vandalism Into Something Beautiful
religion,Power and Powerlessness in Religion
religion,Religious Persecution On the Rise: Minorities Under Threat in the Middle East
religion,New Comic Book Has Exorcists Converging To Stop Hell From Breaking Loose
religion,Proud to Be Roman Catholic Again
religion,Why Some Feminists Refuse To Give Up On Their Faith
religion,Daily Meditation: Fiery Spark
religion,10 Essential Books To Help You Explore The Sikh Faith
religion,What 4 Top Catholic Archbishops Expect From The Pope's Visit
religion,LOOK: Immerse Yourself In These Intricate Mandalas
religion,Was There a Villain in the 2014 Election?
religion,French Bishop Declares Nun's Recovery A Lourdes Miracle
religion,Incompetent Or A Crook?
religion,The Irony of Religious Celibacy
religion,"""Lord, I Do Believe! Help My Unbelief!"": The Lust for Certainty vs. the Risk of Trust"
religion,Weddings and World Peace
religion,When Ebola Comes To Church
religion,Catholic Priest Praised As 'Best Dressed Dude' At Met Gala For Just Living His Life
religion,Response to Bill O'Reilly: Jesus Didn't Start a New Religion
religion,A New Synagogue In Chicago Is Billing Itself As 'Non-Zionist'
religion,Muslim Woman May Pursue Legal Action Against United Airlines After Discrimination
religion,A Serious Thank You Note to Jon Stewart & The Daily Show #Charleston
religion,More Than Brick And Mortar And Country Club Houses
religion,North Carolina Hindu Temple Sign Found Riddled With Holes From Shotgun Blasts
religion,How This Holocaust Survivor Regained His Faith After The War
religion,Does Religion Poison the Well? A Reflection for MLK Day
religion,What This 94-Year-Old Can Teach The World About Bucket Lists
religion,"Ebola, ISIS and Our Borders"
religion,Why Jesus Would Want Us To Speak Out Against Prejudice
religion,The Important Reason This Man Shined Pope Francis's Shoes
religion,Science: How Clergy Can Help Believers Die A ‘Good Death’
religion,"""My Dad's Legacy Is On The Line"""
religion,How Can A Person Of Science Believe In A God?
religion,Survival in Paris
religion,Daily Meditation: By The Riverside
religion,"If I'm Your Token Muslim Friend, Then I Need You to Do This"
religion,Why Jesus Would Say 'Black Lives Matter'
religion,UNESCO Weighs In On Debate Over Where Jesus Was Baptized
religion,Why Oklahoma Rep. John Bennett's Fear Mongering Makes Us Less Safe
religion,Freedom of Expression Is Not Unlimited
religion,Does Romans 13 Give The President The Right To Nuke North Korea?
religion,Watch Jewish Moms Try To Win Bachelorette's Heart For Their Sons
religion,'Who Are We To Judge?'
religion,"A Catholic Charity Is Reaching Out To Transgender People In India, Just Not All Of Them"
religion,Pope Francis Names Progressive To Replace Conservative Chicago Archbishop
religion,Adam And Eve Like You've Never Seen Them Before
religion,Muslim Funny Fest Is Using Comedy To Overcome Stigma
religion,Exhibit Explores Indiana Jones's Quest For Religious Relics
religion,Why Some Mormons Are Preparing For Doomsday
religion,Daily Meditation: Rebuild
religion,Breaking Fast at a Sufi Mosque
religion,Too Many Think American = Christian This 4th Of July
religion,Daily Meditation: Glory
religion,The Most Important Women's Issue You've Never Heard of
religion,'Is It Time To Separate Church And State Marriages?'
religion,Muslim Americans Have Some Advice For Trump On His Islam Speech
religion,Daily Meditation: Give Each Other Love
religion,Ahmadiyya Muslims: A Star in The Constellation of American Faiths
religion,15 Blogs From 2015 That Showed How Faith Can Be A Force For Good
religion,To Serve and to Keep: Responding to Pope Francis' Call to Become Protectors of Creation
religion,Daily Meditation: Wings
religion,ISIS And The Crisis Of Meaning
religion,#Muslims4Ferguson Takes To Twitter To Protest Police Brutality
religion,Bernie Sanders Embodies Trend Of The 'Spiritual But Not Religious' American
religion,Rosh Hashanah 2015: The Jewish New Year Begins
religion,Faith and the 5 Year Old
religion,Protesting Priests Urge Pope To End 'Thousands Of Years Of Misogyny'
religion,Kumail Nanjiani's 'SNL' Monologue Somehow Hilariously Skewers Islamophobia
religion,Musician Jennifer Knapp's TEDx Talk About Being A Lesbian Christian
religion,Hell's Problems: Genocide and 'Humanitarian Intervention'
religion,Yom Kippur 2015: An Introduction To The Jewish Day Of Atonement
religion,7 Deeply Spiritual Moments In Mary Oliver’s New Book Of Poems
religion,Three Vital Lessons From Super Bowl XLIX
religion,Why Does God Hate Sex?
religion,Meeting Kelly Gissendaner
religion,Why Do Bad Hurricanes Happen to Good People?
religion,American Jewish Leaders Dismayed By Mike Huckabee’s Iran Deal Remarks
religion,Knowledge Of Jewish Tradition Can Fight Anti-Semitism In America
religion,Matthew 2:13-23:Significance of Jesus early years
religion,What Is America's First Muslim Fraternity Really Like?
religion,Shmitta: The Bible's Solution to America's Debt Problems?
religion,"Bible, Baltimore and Beyond"
religion,Pope To Prisoners: I Am A Man 'Who Was Saved From His Many Sins'
religion,Female Bishops in the UK: All Our Gifts Are Needed for the Common Good
religion,White Gods and Black Devils: The Rhetoric of Bishop Henry McNeal Turner-Pt. 1
religion,"When I Hear the National Anthem, I Will Kneel and Bow My Head"
religion,No Two Prayer Spaces Are Quite The Same
religion,Growing Up With the Holocaust as a Writer
religion,"Faith Based Activism: Reclaiming ""My"" Religion"
religion,"Religious, Secular Advocates Seek Clarity On IRS Rules For Endorsements"
religion,7 Trends That Offer A Snapshot Of American Religion Today
religion,Anti-Apartheid Archbishop Calls Presbyterians to Back Divestment from Israeli Occupation
religion,Hillsong Church Founder Defends Handling Of Father's Sex Abuse Case
religion,Diffused Congruence Podcast: Al Jazeera's Wajahat Ali on Islamophobia and Muslim Narratives
religion,Snapchat Honors Muslim Holiday With Live Video Feed
religion,Chef Roasts Diner Who Left Note Calling Christmas Music 'Offensive'
religion,The Evangelical War on Halloween
religion,U.S. Navy Faces Lawsuit Over Rejection Of Humanist Chaplain
religion,'Noah' and the Boring Fundamentalism of Hollywood Bible Movies
religion,We Can't Leave Girls And Young Women Behind In The Pursuit Of Education
religion,Happy Rosh Hashana!
religion,What Christians SHOULD Be Saying About Charlottesville
religion,Virginia Church Named For Robert E. Lee Agrees To Change Name
religion,5 Bad Storytelling Habits of Highly Annoying Rabbis
religion,Catholics Reject Church Teachings on Sex
religion,I Flinched At Their Forgiveness
religion,Deah Barakat's Family And Friends Are Turning His Tweet Into A Reality
religion,Florida Gun Store Sued After Declaring 'Muslim-Free Zone'
religion,North Carolina Community Takes on Anti-Muslim Activist
religion,British Churches Celebrate Magna Carta's 800th Birthday
religion,27 Catholic Problems That Are Hilariously Relatable
religion,Why The Pope's Mention Of Thomas Merton Was More Controversial Than You Think
religion,Stumbling Into a Pluralistic Society
religion,A Graphic Novel Is In The Works To Show How Science And Faith Can Coexist
religion,A Muslim's Christmas Message
religion,Pat Robertson Says He's Against Vaccination Mandates
religion,"Without Fear, Without Hatred: Five Years After Oak Creek"
religion,Call It Western Supremacy
religion,Left Behind
religion,My Complex Christianity
religion,Reflections from Rosebud Reservation
religion,"Swastikas, 'Go Trump' Spray-Painted At Beastie Boy's Memorial Park"
religion,Jewish Float To Sail In Amsterdam's Gay Pride Canal Parade
religion,"Letter Revealing How Gandhi Really Felt About Christianity Is Sold For $50,000"
religion,Letter To Pope Ties Bishop To Sex Abuse That Francis Denied Knowing About
religion,Dalai Lama Hints At Rebirth As A Woman Outside China's Influence
religion,What Pope Benedict Knew About Abuse In The Catholic Church
religion,When Sacred Texts Say Terrible Things
religion,Pope Francis Quiz: 19 Questions To Test Your Knowledge
religion,How This Immigrant Shop Owner Is Helping Make Cleveland A 'Cultural Hub'
religion,California Mosques Hit By Possible Hate Crimes During Last Days Of Ramadan
religion,Arkansas State Official Rejects Request To Place Statue Of Hindu Deity On Capitol Grounds
religion,Catholic Bishops Are Urging Congress To Halt Obamacare Repeal
religion,"The Impact of the Jewish People on Humanity, as Traced by Scholars Throughout Time"
religion,Generational Gaps: Immigrant Parents And Their Children
religion,This ‘Average Mohamed' Thinks He Has What It Takes To Defeat ISIS
religion,These Catholic School Students Have A Lot Of Love For Their Gay Teacher
religion,14 Religious Moments That Give Us Hope As 2014 Draws To A Close
religion,Pope's Philadelphia Visit Will Require The Help Of 10K Volunteers
religion,"Chicago Travel Agent Cheated Muslim Pilgrims Over Hajj Trips, Feds Say"
religion,Black Gun Violence Victim Writes Moving Message On Dylann Roof's Facebook Page
religion,Wait for Me Until I Welcome: Further Reflections From an Orthodox Rabbi to His Gay Children
religion,Finding Comfort in Numbers
religion,Most Americans Don't Think Divorce Is A Sin
religion,Every Episode Of Reza Aslan's 'Believer' Will Piss Somebody Off (And It's Awesome)
religion,Pro-Trump Catholics' Faustian Bargain Yields Bitter Fruit
religion,British Public On The Hunt For 'Witches' Marks' This Halloween
religion,'Hoodie Monks' Use Hip Hop To Impart Buddhist Wisdom
religion,"Christmas Eve Mass: Pope Urges 'Tenderness', Calls Christian Refugees In Iraq"
religion,Can Evangelicals and Christians Coexist in America?
religion,Florida Gun Store Sets Up A 'Muslim-Free Zone' After Chattanooga Shooting
religion,Going Back for Judas
religion,Mormon Church To End Its Century-Long Relationship With The Boy Scouts
religion,Why Forgiveness Is At The Center Of Faith For This Black Pastor
religion,Harper Lee's 'Watchmen' Infused With Religious Symbolism
religion,Archbishop Calls For End To Confidentiality In Child Abuse Confessions
religion,WATCH: Americans Open Up About What It's Like To Be Muslim In This Country
religion,In Defense Of Offering Our 'Thoughts and Prayers'
religion,Pope To Elderly Churchgoers: 'I'm A Little Old And A Little Sick'
religion,Dialogue: Hope for a Better World
religion,Daily Meditation: Metamorphosis
religion,Pope Francis Canonized Six New Saints This Weekend
religion,How Members Of Congress Will Be Prevented From Touching The Pope
religion,These Religions Were Born In The U.S.A.
religion,Christian-Run Children's Center Rejects Atheist Group's Huge Donation
religion,The Conservative Media's Assault on Religious Academia
religion,Turkey Approves Construction Of First New Church In Nearly A Century
religion,"Pope Francis, World Religious Leaders Make Impassioned Plea Against Terrorism"
religion,Remembering What Is Impossible to Forget: Moral Injury and War
religion,"U.S. Wins Religious Discrimination Case Against Western Towns Over Access To Housing, Utilities"
religion,James Foley Photo Removed From NYC Anti-Islam Ads
religion,"Once Again, The Right Hijacks That Old-Time Religion"
religion,Pope Puts Climate Heat on GOP
religion,Epiphany 2015 Celebrations Around The World
religion,Teaching Scott Walker What it Means to Pontificate
religion,What This Gay Atheist Learned From Being an Evangelical Christian
religion,Religious Freedom Restoration Acts Restore Bigotry and Repression
religion,Pope Francis: 2 Percent Of Priests Are Pedophiles
religion,What Jesus Might Say If He Tweeted Like Donald Trump
religion,The Marin California Church That Opened Its Doors (Even) For My Family
religion,A Call to Sanctuary
religion,A Joyous Eid In Somalia: Ugaaso Abukar Boocow's Instagram Photos Capture The Celebrations In Mogadishu
religion,Pope Francis Proclaims Mother Teresa A Saint
religion,A Letter to the Church of Abbotsford and Beyond
religion,Pat Robertson: Obama Is 'Pro-Muslim'
religion,"I'm a Pastor, And Donald Trump's America Scares the Crap Out of Me"
religion,11 Tweets That Sum Up The Absurdity of The Burkini Ban
religion,Mosque Is ‘Vandalized’ With Messages Of Love From Local Community
religion,My Seizure Diagnosis: Is There a Pony In This Shitpile?
religion,Turkey Unveils $2.5 Million Great Synagogue As Its Jewish Population Fades Away
religion,Hate Doesn’t Belong In Texas Courts — Or Anywhere Else
religion,"The Pope Just Had A Meeting 1,000 Years In The Making. Here's Why."
religion,ICE Violates First Amendment Rights Of 60 Faith Leaders And Attorneys
religion,Our Great God Gun
religion,The Shepherd from Bethlehem Speaks
religion,Daily Meditation: Freedom
religion,The Little-Known Story Of The Islamic Christmas Tree
religion,America by the Numbers: Part II
religion,'It Could Have Been Any One Of Us': Thousands Across Country Honor Slain Muslim Students
religion,The Ideologies Of American Churches In One Graph
religion,The Most Over-The-Top Christmas Trees Of The Season
religion,Debating Forgiveness In The Face Of Hate
religion,The Legacy Of Evangelical Preacher George Whitefield
religion,The Ironic End Of American Religious Liberty
religion,Imams Sing French National Anthem At Bataclan
religion,"Journalism Tackles 'The Problem With Good Friday,' and an Episcopal Priest Responds"
religion,A Rabbi Walks Into an Evangelical Church
religion,Why Some American Jews Seek To Break Israel's Chief Rabbinate Monopoly
religion,Accidental Saint: The Passion Of Pastor Nadia Bolz-Weber (All Together Podcast)
religion,Daily Meditation: In A Trance
religion,Skeletal Remains Of Patron Saint Of Rape Victims Goes On Display
religion,These May Be Some Of The Tackiest Advent Calendars We've Seen
religion,Being Normal Almost Killed Me
religion,Time Marches On
religion,Roy Moore Is Guilty Of Abusing Girls And Religion
religion,The Pope and the Synod: Mixed Signals From Rome
religion,The Catholic Cup: Brazil 2014
religion,"British Pastors, Politicians Want To Stop U.S. Evangelist From Preaching In Their Town"
religion,Muslim Prisoners Say They Are Forced To Compromise Beliefs In Miami-Dade Prisons
religion,"Avi Weiss, The Rabble-Rouser Rabbi, Takes Stock After An Activist Career"
religion,Muslim Friends Of Beheaded Aid Worker Mourn
religion,"Pennsylvania Diocese Releases Names Of 51 Clergy, Laypeople Accused Of Misconduct"
religion,Muslim Students Share Their Experiences With Islamophobia
religion,Presbyterian General Assembly Biennial Meeting: My Message on Israel and Palestine
religion,Religion Scholar Says Spiritual Revolution Begins In Nature
religion,Pope Uses Christmas Eve Message To Urge Respect For Migrants
religion,"Rick Warren To Pastors: 'Behind Every Ministry, There Is Private Pain'"
religion,Daily Meditation: Become Your Own Light
religion,"The Vatican's Synod on the Family, and Why You've Missed the Point."
religion,Trump Should Not Encourage Politics In Church
religion,Remembering The Bittersweet History Of Father's Day
religion,Managing Christianity Into Impotence
religion,Ecstasy And Despair On This Historic Day
religion,Christians Must Resist White Supremacy
religion,Daily Meditation: In Mourning
religion,"Religion, Satire, And Society In The Shadow Of Charlie Hebdo"
religion,Christians In The U.S. Are Not Persecuted
religion,Libraries Burning: From Sarajevo to Mosul
religion,Walking the Via Dolorosa: Young People in Solidarity--Until the End
religion,My Very Personal Happy Christmas Story
religion,An Important Sign: Verse Posted in Public Trumps Concern Over Torture
religion,Losing Their Religion: Rise of the Nones
religion,U.S. Missionary Doctor Discharged After Recovering From Ebola
religion,New Series On 'The Secret Life Of Muslims' Aims To Subvert Stereotypes
religion,Missing In Action -- Where Was The U.S. Women's Movement On Justice For Nabra Hassanen?
religion,Mindful Education: Meditation as a Compassionate Movement
religion,The Madness of Rev. Kurt Dunkle and the Trustees of General Theological Seminary
religion,More Jewish Community Centers Receive Bomb Threats During Purim Holiday
religion,Myanmar Is Picking Up The Pieces After Earthquake Damaged Ancient Pagodas
religion,Obama Hosts Annual Ramadan Iftar Dinner At The White House
religion,Louisville Will Not Let Vandalized Islamic Center Suffer Alone
religion,WWJD: What Would Jesus Do? Do You Really Want to Know?
religion,Losing Our Religion: The Death of Christian Mosul
religion,There's Going To Be A Hanukkah Party At A Trump Hotel And These Jews Aren't Happy
religion,The King and His Jester: Religion and Its Acceptable Transgressions
religion,Defining What It Means To Be Religious
religion,Evolving to Survive Ourselves
religion,"The Headscarf, Fear, And Islamophobia"
religion,How Synagogues Honor Non-Jewish Congregants On Yom Kippur
religion,Indiana's Church Of Cannabis Files Religious Liberty Lawsuit
religion,Daily Meditation: The Future Of God
religion,Indianapolis Follows Louisville With a Festival of Faiths
religion,Daily Meditation: Forgive Yourself
religion,Donald Trump's Proposed Muslim Ban Has Not Aged Well: A Timeline
religion,Reb Zalman's Unique Funeral
religion,The Business of Faith - An Interview with Al Erisman
religion,Thank God for Atheists!
religion,"This Conservative Christian Is Not Scared Of Refugees, Even If Some Turn Out To Be Terrorists"
religion,Vatican: Tone Down The Peace!
religion,Pope Francis Reaches Out To Bolivia's Poor Workers
religion,Friends of the Chapel Hill shooting victims share their memories
religion,From 'Charlie Hebdo' to 'Je Suis Ahmad'
religion,Retired Pope Benedict XVI Celebrates 88th Birthday With A Pint
religion,Pope Francis' Remarks To Inmates At Curran-Fromhold Correctional Facility (Full Transcript)
religion,"Catholic Families Are Strong On Prayer But Weak On Sacraments, According To Study"
religion,Living In The Balance: An Earth Day Reflection
religion,Video Appears To Show Man Floating Around Kaaba In A 'Hoverboard'
religion,Inclusion Gone Too Far: Cal State and InterVarsity 'Derecognition'
religion,Open Letter to Presbyterian Church U.S.A. from the Palestinian Christian Alliance for Peace
religion,Ferguson's Grand Jury Decision Could Produce the Seeds of Change
religion,Lending Our Voices to Kelly
religion,Pope Francis Sends Blessing To Young Athlete Fighting Leukemia
religion,Georgia Pastor Has No Time For Anti-LGBT Hypocrites
religion,Brazilian And Chinese-American Apostles Diversify Mormon Church Leadership
religion,Africa's Islamic Extremist Problem Doesn't End With Boko Haram
religion,Post-War on Christmas
religion,"Inderjit Singh Mukker, Chicago-Area Sikh, Allegedly Attacked And Called 'Terrorist,' 'Bin Laden'"
religion,Crew Member Who Refused Muslim Woman Unopened Soda Won't Fly With United Again
religion,Mary Magdalene: The Single Best Argument For Women Priests
religion,3 Ways LGBT Christians Are Blessing the Church
religion,Baha'i Prayer and Quotes About America
religion,How Mass Shootings Are Changing Americans' Views Of Mortality
religion,Religious Leaders See Delayed Execution As Act Of God
religion,Pope Appeals To Let Love Heal All Wounds At Festival Of Families
religion,Beyond Borders: An Unexpected Trip to Mexico With a Dying Man
religion,Pope Francis Baptizes 10 At Easter Vigil At Vatican
religion,England May Soon Have Its First Women-Only Mosque
religion,"HBO Is About To Premiere A Series About An Attractive, Conniving Pope"
religion,Sacred Earth: Pope Francis and Bonna Devora Haberman
religion,Pope: Exploitation Of Nature Is Sin Of Our Time
religion,Rapper Has Choice Words For Christians Who Don’t Want Him To Talk About Race
religion,My Message On Donald Trump
religion,How Italians Are Carrying Out Pope's Vision To Serve Refugees
religion,Is ISIS Islamic? Why This Is the Wrong Question to Ask
religion,Pope Francis: Don't Forget To Look For 'Signs Of Love' In The World
religion,Ramadan Reflection Day 7: Prayers for the People of Burma's Concentration Camps
religion,The Charleston Massacre
religion,Archbishop Desmond Tutu Returns To The Hospital With An Infection
religion,Bill Nye: Creationism Is 'Raising A Generation Of Young People Who Can't Think'
religion,Daily Meditation: A Thousand Beautiful Things
religion,Religious Persecution Makes Migrants Out Of Millions
religion,These Sacred Mothers Show Us The Power Of Women's Spirituality
religion,My Spiritual Greek Easter!
religion,Pope Francis Reinstates Priest Suspended For Communist Beliefs
religion,Torture and the Killing of Jesus
religion,The Vatican Is Putting Finishing Touches On Its Showers And Barber Shop For The Homeless
religion,"Debbie Reynolds, Carrie Fisher, Mortality And Us"
religion,Pope Francis To Allow Priests To Forgive Women Who Had Abortions
religion,Christian Twitter Is Calling Out The Hypocrisy Of New Health Care Bill
religion,Are Undocumented Immigrants Welcome At America's Thanksgiving Table?
religion,Daily Meditation: Sacred Service
religion,Donald Trump's Bad Week With Evangelicals Just Got Even Worse
religion,Americans Who Identify As Spiritual Feel More Gratitude And Life Satisfaction
religion,Keep Working And Never Ever Give Up!
religion,4 Simple Ways To Stay Grounded And Stress-Free During The Holidays
religion,Why Pastor Nadia Bolz-Weber Thinks Church Is For Losers
religion,Christians Wrestle With Billy Graham's Legacy
religion,Christmas Story Sidelines Mary's Humanity
religion,Pope Francis Denounces 'Fear' Politics Amid Global Anti-Immigrant Sentiments
religion,How Faith Leaders Are Grappling With The Violence Of This Week
religion,We Are a Country of Cowards
religion,'Violent Night': A Post-Christmas Meditation for the Cosmos Generation
religion,"My Problem With Millennial Christians, From A Fellow Millennial Christian"
religion,New Book Explores Cost Of 'Jewish Particularism'
religion,The Meaning of Goodness
religion,Ramadan Reflection Day #20: Selfless Worship -- What Have I Done This Ramadan? (Video)
religion,Mahershala Ali's Oscar Nod Is An Important Step For The Academy
religion,Auschwitz: A Cry of Despair and a Warning
religion,Pope Francis Compares Gossiping Nuns To Terrorists
religion,"Interfaith Leaders Pledge To Stand By American Muslims, No Matter What"
religion,Cardinal Burke: Catholic Church Under Pope Francis Is 'A Ship Without A Rudder'
religion,"Rev. Franklin Graham, Your God Is Too Small"
religion,Confessions of an Altar Boy Wannabe
religion,Hispanic Churches Look Within To Nurture Musical Leadership
religion,The Vatican's Spectacular Christmas Stamps
religion,Houses Of Worship Explore Creative Designs To Serve People With Disabilities
religion,Vatican: Gay People Are 'Our Sons And Daughters'
religion,Discerning and Hearing Divine Guidance Isn't Always Easy
religion,Vatican Receives Ransom Demand For Stolen Artifacts
religion,"The Clergy Letter Project, More Than 14,000 Clergy Members Strong, Condemns White Supremacism"
